Mayor of Obrenovac insulted woman on Twitter,The president of the Belgrade Municipality of Obrenovac Miroslav Cuckovic insulted a woman on Twitter by using very vulgar words.,Fraud, threats and manipulations,Character assassination,Verbal attacks,,,,,Authority figures,The public,2016-10-16,,,https://twitter.com/Cuckovicm/status/787644316852350976,https://archive.li/EPwTs,,,,
Journalist from Leskovac threatened,Blic reporter and Jugmedia portal editor Milica Ivanović received threats from a Facebook profile named Aleksandar S.,Fraud, threats and manipulations,Endangering security,Direct threats of violence, including threats of a sexual or physical nature,,,,,Unknown,Media sector,2016-10-31,,,https://www.cenzolovka.rs/vesti/pretnje-leskovackoj-novinarki-na-fejsbuku-unisticu-ti-zivot-bolesnice-odvratna/,https://archive.li/2v043,,,,
Danas website under cyberattack,Danas website was attacked on multiple occations, also from IP addresses of public utilites. Danas claimed that the attacks started after the text "What Andrej Vučić Does" was published. ,Cyber incidents,Disabled services,DoS/DDoS,,,,,Unknown,Media sector,2016-11-04,,,http://www.danas.rs/redakcijski_komentar/redakcijski_komentar.1146.html?news_id=331571&title=%C4%8Cime+se+bave+%26quot%3Banaliti%C4%8Dari%26quot%3B,https://archive.li/FeYil,,,,
Police identified a person suspected of posting threatening Facebook comments against Danas's editor-in-chief Dragoljub Draza Petrović,Police identified a person suspected of posting threatening Facebook comments against Danas's editor-in-chief Dragoljub Draza Petrović. The comments were posted on the Facebook page of Cenzolovka under Petrović's interview from November 8.,Fraud, threats and manipulations,Endangering security,Direct threats of violence, including threats of a sexual or physical nature,,,,,Individual,Media sector,2016-11-10,,Viši sud u Beogradu osudio pocinioca na jednu godinu zatvora, uslovno na tri godine, zbog krivicnog dela ugrožavanja sigurnosti., http://rs.n1info.com/a207100/Vesti/Vesti/Pronadjen-osumnjiceni-za-pretnje-Drazi-Petrovicu.html,https://www.cenzolovka.rs/vesti/pronaden-osumnjiceni-za-pretnje-drazi-petrovicu-na-cenzolovci/,https://www.danas.rs/vesti/drustvo/uslovna-kazna-zatvora-zbog-pretnji-uredniku-danasa/,https://archive.li/MF5aP,https://archive.li/eoJBz,https://archive.li/4b8Da
Z.M. (34) from Belgrade was arrested under suspicion that he threatened N1 TV employees via Facebook.,Z.M. (34) from Belgrade was arrested under suspicion that he threatened N1 TV employees via Facebook.,Fraud, threats and manipulations,Endangering security,Direct threats of violence, including threats of a sexual or physical nature,,,,,Individual,Media sector,2016-11-17,2016-11-17,Pravosnažno osuden na godinu dana zatvora uslovno,Pravosnažno osuden na godinu dana zatvora uslovno,,,,,
Person who threatened Vučić's daughter on Kurir's Facebook page arrested,Miroslav Cuckovic, president of the Municipality of Obrenovac, insulted Istinomer journalist Jasmina Prodanovic via Twitter.,Fraud, threats and manipulations,Limiting freedom of expression,Verbal attacks,Character assassination,Verbal attacks,,,Authority figures,Media sector,2016-12-01,,,https://twitter.com/Cuckovicm/status/803926777768869888,https://insajder.net/sr/sajt/vazno/2244/Miroslav-%C4%8Cu%C4%8Dkovi%C4%87-novinarku-Istinomera-nazvao-%E2%80%9Evoajerom-psihopatom%E2%80%9C.htm,https://archive.li/yLd1g,,,
Vulin threatened via Facebook,In cooperation with the Prosecution for Cyber Crime, the police arrested M.R. (1988) under suspicion that he threatened the daughter of Aleksandar Vučić on the Facebook page of Kurir, where people could express support for presidential candidates.,Fraud, threats and manipulations,Endangering security,Direct threats of violence, including threats of a sexual or physical nature,,,,,Individual,Political subject,2016-12-06,,,Priveden osumnjiceni,,,,,
Ivan Ivanović threatened after Fajgelj's video,Aleksandar Vulin, Minister of Labour, Employment, Veteran and Social Policy, received threats on Facebook by a user from Croatia.,Fraud, threats and manipulations,Endangering security,Direct threats of violence, including threats of a sexual or physical nature,,,,,Individual,Political subject,2016-12-06,,,https://twitter.com/Astr0G/status/805917503142641664?s=09,https://archive.li/DFN0n,,,,
Fajgelj's "NATO Poodle" video,The comments to a video shared by Andrej Fajgelj insulted a number of public figures and even threatened TV host Ivan Ivanović.,Fraud, threats and manipulations,Endangering security,Direct threats of violence, including threats of a sexual or physical nature,,,,,Individual,Media sector,2016-12-06,,,https://www.danas.rs/drustvo/satiricari-na-spisku-nato-pudlica/,https://www.intermagazin.rs/fajgelj-isprozivao-medijske-licnosti-ivan-ivanovic-je-nato-pudlica-video/,http://archive.li/lk6FS,,,
Fajgelj's "NATO Poodle" video,Andrej Fajgelj uploaded a YouTube video in which numerous public figures were called foreign mercenaries and "NATO poodles".,Fraud, threats and manipulations,Character assassination,Creating and sharing fake content,Character assassination,Verbal attacks,,,Public figures,Public figures,2016-12-14,,,https://www.danas.rs/drustvo/satiricari-na-spisku-nato-pudlica/,https://www.intermagazin.rs/fajgelj-isprozivao-medijske-licnosti-ivan-ivanovic-je-nato-pudlica-video/,http://archive.li/lk6FS,,,
Sasa Đorđević from BCBP insulted by state secretary over tweet,Sasa Đorđević, researcher from the Belgrade Centre for Security Policy (BCBP), tweeted a link to an article published by Business Insider which said that Belgrade was the second most dangerous city in Europe. Biljana Popovic Ivkovic, state secretary from the Ministry of Internal Affairs, made insults against Đorđević for publishing this.,Fraud, threats and manipulations,Limiting freedom of expression,Verbal attacks,,,,,Authority figures,Civilian sector,2016-12-27,,,,,,,,
Web journalist Nenad Mihailovic threatened,A YouTube user threatened web journalist Nenad Mihailovic in a comment to one of his videos.,Fraud, threats and manipulations,Endangering security,Direct threats of violence, including threats of a sexual or physical nature,,,,,Individual,Media sector,2017-01-02,,,,,,,,
Death threats against Djordje Balasevic,Djordje Balasevic's daughter posted on Twitter that her father had received death threats.,Fraud, threats and manipulations,Endangering security,Direct threats of violence, including threats of a sexual or physical nature,,,,,Individual,Public figures,2017-01-05,,,https://twitter.com/kenobibaby/status/817099296717869057?ref_src=twsrc%5Etfw,https://archive.li/324l4,,,,
Fake news about Bojana Maljevic,A fake news appeared saying that Bojana Maljevic promoted the Serbian Progressive Party. She immediately denied on Twitter.,Fraud, threats and manipulations,Character assassination,Creating and sharing fake content,,,,,Unknown,Public figures,2017-01-07,,,https://twitter.com/BojanaMaljevic/status/817536324236414976,https://archive.li/45JmL,,,,
Online fraud − Maxi ransomware attack,Internet users in Serbia received emails of suspicious content pretending to be a competition organised by the big supermarket chain Maxi. Maxi announced that it had nothing to do with these emails and warned people not to open them. ,Cyber incidents,Online scams,Fake resources (fake website, email),,,,,Unknown,The public,2017-01-13,,,http://www.informacija.rs/Virus/OPREZ-Trgovinski-lanac-Maxi-upozorio-korisnike-na-lazne-emailove-koji-kriju-ransomware-Marlboro.html,https://archive.li/jZIAP,,,,
RTV Sabac website hacked,The website of RTV Sabac was hacked after the program called "Interview" in which the guest was the leader of Nova Srbija party Velimir Ilic. ,Cyber incidents,Disabled services,DoS/DDoS,,,,,Unknown,Media sector,2017-01-19,,,https://www.cenzolovka.rs/pritisci-i-napadi/rtv-sabac-nakon-emisije-intervju-sa-velimirom-ilicem-oboren-sajt/,https://archive.li/Yw2ef,,,,
Facebook page of Fishing Association hacked,The Facebook page of the Fishing Association of Serbia was hacked, after which it started posting inappropriate content.,Cyber incidents,Overtaking control,Technical attacks,,,,,Unknown,Media sector,2017-01-27,,,http://www.ribolov.co.rs/hakovana-oficijelna-fb-stranica-ribolovackog-portala-srbije/,https://archive.li/SIg14,,,,
Fake e-mails by Komercijalna Banka,Internet users in Serbia received fake emails by Komercijalna Banka ("Commercial Bank"), which contained a virus.,Cyber incidents,Online scams,Fake resources (fake website, email),,,,,Unknown,The public,2017-02-24,,,http://www.telegraf.rs/vesti/2635838-cuvena-srpska-banka-upozorila-ako-ste-dobili-ovu-poruku-mozda-vam-neko-upravo-krade-pare-s-racuna,https://archive.li/dzvfW,,,,
Belgrade Open School website changed in cyberattack,The design of Belgrade Open School's webiste was changed in a cyberattack.,Cyber incidents,Overtaking control,Technical attacks,,,,,Unknown,Civilian sector,2017-02-24,,,,,,,,
Three lawuits against Bor journalist,Zivorad Petrović, president of the Municipality of Bor, his brother and director of Bor Residential Maintenance public utility Goran Petrović, and head of Bor Municipal Directorate Ljubinka Jelic filed three private lawsuits against Ljubisa Marinkovic, founder of a local weekly newspaper, over a series of texts he published on bor-sve.net portal, in which he pointed to illegitimate processes related to the work of Bor's municipal government.,Fraud, threats and manipulations,Limiting freedom of expression,Abuse of legal mechanisms,,,,,Authority figures,Media sector,2017-03-08,,,http://beta.rs/vesti/drustvo-vesti-srbija/56323-za-30-minuta-tri-tuzbe-protiv-jednog-novinara-u-boru,https://archive.li/U4yEI,,,,
DDoS attack against Sasajankovic.rs,The official website of presidential candidate Saša Janković (sasajankovic.rs) was unavailable on March 9–10. It was suspected that this was a result of a DDoS attack which "swamped" the server with automatic access requests in order to disable it.,Cyber incidents,Disabled services,DoS/DDoS,,,,,Unknown,Public sector,2017-03-09,2017-03-10,,https://labs.rs/sr/izbori2017/,http://archive.li/fMKNX,,,,
Text about alleged political bots in Obrenovac,A list and corresponence of people who are allegedly political bots, i.e. Internet team members of the Serbian Progressive Party in Obrenovac, became pubicly available.,Privacy and data protection,Disclosure of data,Posting on a social network, blog, chat app,,,,,Unknown,Mass casualty,2017-03-10,,,https://medium.com/@obrenovac.bot/svi-obrenova%C4%8Dki-botovi-4431719fe22e#.yn5y2qx2p,https://archive.li/HIv7F,,,,
Lawyer targeted on social networks for filing complant against Ljubisa Preletacevic Beli's presidential candidacy,After lawyer Miroje Jovanović filed a complaint to the Republic Electoral Commission regarding the presidential candidacy of Luka Maksimovic – Ljubisa Preletacevic Beli, supporters of this candidate targeted Jovanović in an organised way. His Facebook profile was soon suspended because of numerous complaints. In addition, his personal data was shared on social networks, he was swamped with messages some of which were insulting and threatening, and there was even an online game in which Jovanović was a target.,Privacy and data protection,Disclosure of data,Posting on a social network, blog, chat app,Endangering security,Collection, manipulation, dissemination and misuse of personal data,,,,Individual casualty,2017-03-15,,,https://resursi.sharefoundation.info/sr/resource/gradanske-akcije-na-internetu-i-krivicna-odgovornost/,http://archive.li/hsqAI,,,,
Lawyer targeted on social networks for filing complant against Ljubisa Preletacevic Beli's presidential candidacy,After lawyer Miroje Jovanović filed a complaint to the Republic Electoral Commission regarding the presidential candidacy of Luka Maksimovic – Ljubisa Preletacevic Beli, supporters of this candidate targeted Jovanović in an organised way. His Facebook profile was soon suspended because of numerous complaints. In addition, his personal data was shared on social networks, he was swamped with messages some of which were insulting and threatening, and there was even an online game in which Jovanović was a target.,Fraud, threats and manipulations,Limiting freedom of expression,Direct threats of violence, including threats of a sexual or physical nature,Limiting freedom of expression,Organized reporting of accounts or content,,,Political subject,The public,2017-03-15,,,https://resursi.sharefoundation.info/sr/resource/gradanske-akcije-na-internetu-i-krivicna-odgovornost/,http://archive.li/hsqAI,,,,
2017 elections − fake Facebook page of Saša Janković,A fake page of Saša Janković appeared on Facebook. It represented him as the presidential candidate of the Democratic Party.,Fraud, threats and manipulations,Endangering security,Direct threats of violence, including threats of a sexual or physical nature,,,,,Individual,Political subject,2017-03-16,,Podneta krivicna prijava,Podneta krivicna prijava,,,,,
Database of economic and political profiles of over 400,000 1 publicly available,Serbian public found out about a large database which was used for political purposes; namely, it was used for economic profiling with the aim of influencing people to vote. This database contained data of over 400,000 1 from the entire country, sorted into 222 tables of towns and villages.,Privacy and data protection,Unauthorized collection of personal data,Violation of the principle of legality (processing without a legal basis),Data leakage,Unknown,,,Responsible person from a political party,Mass casualty,2017-03-25,,,http://rs.n1info.com/Vesti/a237644/Sta-stranke-znaju-o-vama-Procurili-podaci-400.000-gradjana.html,http://archive.li/POI1p,,,,
Fake Facebook policeman profile,A fake policeman profile posted comments about Against Dictatorship (Serb. Protiv Diktature) protests and insulted the participants.,Fraud, threats and manipulations,Endangering security,Direct threats of violence, including threats of a sexual or physical nature,Character assassination,Creating and sharing fake content,,,Unknown,The public,2017-04-04,,,https://twitter.com/kokota/status/849250620213211137,https://archive.li/sKr5g,,,,
The management of the Independent Journalists' Association of Vojvodina received death threats,The management of the Independent Journalists' Association of Vojvodina received death threats after some tabloids published that they were the organizers of mass post-election student protests in Novi Sad, which was untrue. ,Fraud, threats and manipulations,Endangering security,Direct threats of violence, including threats of a sexual or physical nature,Character assassination,Creating and sharing fake content,,,Unknown,Media sector,2017-04-06,,Podneta krivicna prijava,Podneta krivicna prijava,,,,,
Citizen gave statement to police about video on alleged irregular elections,After sharing a video about alleged manipulation with votes in the election, Predrag Gostovic was brought in to give a statement to the police. It turned out that the video was not real and that everything was a joke.,Fraud, threats and manipulations,Limiting freedom of expression,Abuse of legal mechanisms,,,,,Authority figures,The public,2017-04-11,,Gradanin pozvan na informativni razgovor,Gradanin pozvan na informativni razgovor,,,,,
President of the Independent Journalists' Association of Vojvodina receives threats via Facebook,Nedim Sejdinovic, president of the Independent Journalists' Association of Vojvodina, received dozens of insults and threats after posting a yellow duck image and "Happy Big Duck" (Serb. "Srecan Veliki Patak"). The yellow duck was the symbol of Don't Drown Belgrade (Serb. Ne davimo Beograd) citizen initiative. ,Fraud, threats and manipulations,Limiting freedom of expression,Verbal attacks,Endangering security,Verbal attacks,,,Individual,Media sector,2017-04-15,,Podneta krivicna prijava,Podneta krivicna prijava,,,,,
Fake email messages by Ivica Dacic,An unidentified person presented themselves as Serbia's Minister of Foreign Affairs and from a fake address Ivica.Dacic@mfa.gov.rs sent emails to embassies requesting money.,Cyber incidents,Online scams,Fake resources (fake website, email),,,,,Unknown,Public sector,2017-04-29,,,http://www.kurir.rs/vesti/politika/prevara-lazni-dacic-varao-ambasadore-clanak-2806303,https://archive.li/lhzJG,,,,
Balkanist online magazine hacked,Balkanist online magazine was attacked by hackers who erased some pages. The technical support team managed to recover the pages after the attack. ,Cyber incidents,Overtaking control,Technical attacks,,,,,Unknown,Media sector,2017-05-06,,,https://twitter.com/UnaHajdari/status/872185899030892550,http://archive.li/oayjP,,,,
Texts about Mica Jovanović inserted into Vreme's (Eng. "The Time's") archive,Unidentified hackers attacked the website of Vreme (Eng. "The Time") weekly newspaper and erased five texts from its archive. Instead of those texts, five different texts appeared, with affirmative content about Mica Jovanović, John Nesbitt University owner. All these texts were written in very bad English.,Cyber incidents,Overtaking control,Technical attacks,,,,,Unknown,Media sector,2017-05-10,,,https://www.facebook.com/Vreme1990/photos/a.334459239982224.80138.222121941215955/1355146941246777/?type=3&theater,https://archive.li/MHu54,,,,
The National Bank of Serbia lost 175,000 EUR in email fraud,The National Bank of Serbia paid 175,500 EUR onto a fake account after it received a fraudulent request from an email address with one letter changed.,Cyber incidents,Online scams,Fake resources (fake website, email),,,,,Unknown,Public sector,2017-05-24,,Podneta krivicna prijava,http://www.blic.rs/vesti/drustvo/kako-je-prevarena-nbs-izmenili-jedno-slovo-u-imejl-adresi-i-ojadili-banku-za-175500/b8d362b,https://archive.li/Kjr0k,,,,
Police confiscated phone and passwords for Twitter and email account,Activist Dragan Murar had his phone and passwords for Twitter and email taken away by the police after his tweets which the prosecution interpreted as violent.,Privacy and data protection,Unauthorized collection of personal data,Violation of the principle of legality (processing without a legal basis),,,,,Responsible person from the public sector,Individual casualty,2017-06-05,,Oduzet telefon i šifra za Tviter,http://rs.n1info.com/a273957/Vesti/Vesti/Kad-policija-hapsi-tviter-imejl-i-mobilni-telefon.html,https://twitter.com/muki68/status/870738439733485568,https://archive.li/C9iI6,,,
Police confiscated phone and passwords for Twitter and email account,Activist Dragan Murar had his phone and passwords for Twitter and email taken away by the police after his tweets which the prosecution interpreted as violent.,Fraud, threats and manipulations,Limiting freedom of expression,Abuse of legal mechanisms,,,,,Authority figures,Civilian sector,2017-06-05,,Oduzet telefon i šifra za Tviter,http://rs.n1info.com/a273957/Vesti/Vesti/Kad-policija-hapsi-tviter-imejl-i-mobilni-telefon.html,https://twitter.com/muki68/status/870738439733485568,https://archive.li/C9iI6,,,
President of League of Social Democrats of Vojvodina Nenad Canak threatened on Facebook,Politician Nenad Čanak received death threats via Facebook in a private message.,Fraud, threats and manipulations,Endangering security,Direct threats of violence, including threats of a sexual or physical nature,,,,,Unknown,Political subject,2017-06-14,,Pretnje prijavljene policiji,Pretnje prijavljene policiji,,,,,
Cenzolovka journalist threatened on Facebook,After Cenzolovka journalist Marija Vučić pulished a text about the ban on showing the film "Albanians are Our Sisters", she receieved threats via Facebook.,Fraud, threats and manipulations,Endangering security,Direct threats of violence, including threats of a sexual or physical nature,,,,,Individual,Media sector,2017-06-27,,,Pretnje prijavljene policiji i VTK tužilaštvu,,,,,
Adria Media Group and all its media hacked,Adria Media Group and all its electronic issues, video-production, live streaming, network infrastructure and equipment were hacked in an attack which lasted for over 11 hours and which used the technique of server "swamping" to make content unavailable.,Cyber incidents,Disabled services,DoS/DDoS,,,,,Unknown,Media sector,2017-06-28,,,http://www.kurir.rs/vesti/drustvo/2871521/hakerski-napad-na-adrija-medija-grupu-i-sve-njene-medije,https://archive.li/zpRyj,,,,
Autonomija portal columnist threatened via social networks,Igor Besermenji, columnist of portal Autonomija.info, received death threats via social networks. The case was reported to the police but the perpetrator has still not been found.,Fraud, threats and manipulations,Endangering security,Direct threats of violence, including threats of a sexual or physical nature,,,,,Unknown,Media sector,2017-06-28,,Pretnje prijavljene policiji,Pretnje prijavljene policiji,,,,,
Former director of Elektromreza Srbije sued Peščanik,Nikola Petrović, former director of Elektromreza Srbije ("Electrical Networks of Serbia") public utility company, sued Vesna Pešić and Peščanik portal because of the text in which he was connected to the "windfarm affair", which damaged his reputation.,Fraud, threats and manipulations,Limiting freedom of expression,Abuse of legal mechanisms,,,,,Authority figures,Media sector,2017-07-15,,,https://www.cenzolovka.rs/pritisci-i-napadi/nikola-petrovic-trazi-300-000-zbog-pominjanja-uz-aferu-vetropark/,https://archive.li/08vY3,,,,
Technical attacks against Jugpress and Nova Nasa Rec websites,The websites of Regional info agency Jugpress and Nova Nasa Rec weekly newspaper from Leskovac were hacked from over 40,000 IP addresses.,Cyber incidents,Disabled services,DoS/DDoS,,,,,Unknown,Media sector,2017-07-31,,,http://www.danas.rs/drustvo.55.html?news_id=352545&title=Napadi+na+medijske+sajtove,https://archive.li/KS8FW,,,,
Loopia.rs database hacked,The server and database of hosting provider Loopia.rs from Sweden were hacked. According to the email sent to users by the company's director, an unidentified perpetrator accessed the server containing data of account owners (name, address, contact phone, etc.).,Cyber incidents,Overtaking control,Technical attacks,,,,,Unknown,Private sector,2017-08-28,,,https://twitter.com/ivanmarkovicsec/status/901117929588224001,https://archive.li/Hsqzv,,,,
Maglocistac journalists threatened,After publishing the text "We're All Workers of Gosa and Rulers are Labans" about the mayor of Subotica, the employees of Maglocistac portal received death threats.,Fraud, threats and manipulations,Endangering security,Direct threats of violence, including threats of a sexual or physical nature,,,,,Unknown,Media sector,2017-09-11,,,http://rs.n1info.com/a316566/Vesti/Vesti/Pretnje-smrcu-zaposlenima-u-portalu-Maglocistac.html,http://safejournalists.net/rs/portfolios/threathens-maglocistac-newsroom/,https://archive.li/Oskz0,,,
Lies about Vukasin Obradovic spread on Twitter,Twitter account @popmoderan published false news that Vukasin Obradovic is dead.,Fraud, threats and manipulations,Public misinformation,Creating and sharing fake content,,,,,Unknown,Media sector,2017-09-25,,,https://twitter.com/popmoderan/status/912282468698460160,https://archive.li/0YgIk,,,,
Cyberattack against portal Kossev,Portal Kossev was targeted by a heavy technical attack, more precisely a DDoS attack which came from thousands of IP adresses.,Cyber incidents,Disabled services,DoS/DDoS,,,,,Unknown,Media sector,2017-09-29,,,https://www.facebook.com/notes/kosovo-sever-portal/kossev-pod-jakim-hakerskim-napadom/1129319363879628/,https://archive.li/B4Sfj,,,,
KRIK editor insulted after his text about minister Vulin,Offensive announcements against KRIK's editor Stevan Dojčinović was posted on the official website and Facebook page of the Socialist Movement, the portal which promotes the activities of minister Vulin (vulin.rs), as well as a number of other daily media.,Fraud, threats and manipulations,Character assassination,Verbal attacks,Public misinformation,Creating and sharing fake content,,,Authority figures,Media sector,2017-09-29,,,http://www.vulin.rs/reagovanja/dojcinovicu-koliko-si-novca-dobio-od-stranaca.html,http://rs.n1info.com/a331388/Vesti/Vesti/Urednik-KRIK-a-tuzio-Pokret-socijalista.html,https://archive.li/TmUy7,,,
Unidentified persons took over Facebook activist's profile,Unidentified persons took over the Facebook account of activist Radovan Nenadic, who informed the public about this by posting a security email message sent by Facebook.,Cyber incidents,Overtaking control,Technical attacks,,,,,Unknown,Civilian sector,2017-10-03,,,https://www.facebook.com/photo.php?fbid=10155702235934076&set=a.10150295283519076.352178.699799075&type=3&theater,https://archive.li/3NwF3,,,,
Commissioner Šabić threatened on Twitter,Commissioner Rodoljub Šabić was threatened on Twitter after his tweets about political bots and their activities on social networks.,Fraud, threats and manipulations,Endangering security,Direct threats of violence, including threats of a sexual or physical nature,,,,,Unknown,Political subject,2017-10-28,,,http://www.h8index.org/Report?id=314,https://twitter.com/MilicevMiroslav/status/923420763927007232,https://archive.li/Z35vg,,,
YUCOM director threatened on Twitter,Director of YUCOM Milan Antonijevic received threats on Twitter after his statements about general Vladimir Lazarevic, war crime convict.,Fraud, threats and manipulations,Endangering security,Direct threats of violence, including threats of a sexual or physical nature,,,,,Unknown,Civilian sector,2017-10-28,,Podneta krivicna prijava,Podneta krivicna prijava,,,,,
