Serbian Minister Insulted Film Director on Instagram,Minister of Labour Darija Kisić Tepavčević published an insulting post about Serbian film director Goran Marković on her official Instagram account. Marković is known for criticising the current government led by the Serbian Progressive Party and the President of Serbia, Aleksandar Vučić.,Fraud, threats and manipulations,Discrimination and hate speech,Verbal attacks,,,,,Political subject,Public figures,2021-12-17,,,https://rs.n1info.com/vesti/kisic-tepavcevic-izvredjala-reditelja-anamneza-bolesti-gorana-markovica/,https://archive.li/8SxmU,,,,
Serbian COVID Passes Found to Leak Personal Data,BBC in Serbian journalists discovered that citizens’ personal data was being leaked from their “COVID passes”, which are mandatory for customers in bars and restaurants after 8pm in Serbia. The links to sensitive data remained stored in mobile devices after they scan the QR codes from the certificates, the journalists warned. After they contacted Serbia’s government office for IT and e-Government, the data displayed when the code was read was reduced.,Privacy and data protection,Data leakage,Curenje na veb sajtu (uključujući javne registre i platforme) ,,,,,Responsible person from the public sector,Mass casualty,2021-12-23,,,https://www.bbc.com/serbian/lat/srbija-59801978,https://archive.li/JaGE2,,,,
Serbian Journalist Threatened and Insulted on Instagram,A journalist from Nova.rs portal, Pero Jovović, has again received threats and insulting direct messages on Instagram, some of them death threats.,Fraud, threats and manipulations,Endangering security,Verbal attacks,Endangering security,Direct threats of violence, including threats of a sexual or physical nature,,,Unknown,Media sector,2022-01-12,,,https://www.cenzolovka.rs/pritisci-i-napadi/sve-po-starom-i-u-novoj-godini-novinaru-peru-jovovicu-ponovo-upucene-jezive-pretnje/,https://archive.li/3TibL,,,,
Satirical Stories About Serbian Tennis Star Published as News,Online media outlets in Serbia reported that satirical stories linked to the legal battle of Serbian tennis star Novak about his trip to Australia, which ended in his deportation because of his COVID-19 status, are being published as news. Examples reported on as news is a story of Serbs allegedly roasting a kangaroo in Australia in support of Đoković and an alleged survey, which said that more Australians supported deporting the Prime Minister of Australia, Scott Morrison, rather than Đoković.,Fraud, threats and manipulations,Public misinformation,Content manipulation,,,,,Media sector,The public,2022-01-13,,,https://fakenews.rs/2022/01/13/cumur-za-kengure-i-hepo-kocke-za-satiru/,https://archive.li/DQwnw,,,,
Serbian Bank Warns of Fake Giveaway on Facebook, Serbia’s Mobi Bank warned users on its Twitter account that a fake Facebook account of the bank is spreading disinformation about a non-existent giveaway. It urged users not to follow the instructions of the fake account.,Cyber incidents,Online scams,Fake resources (fake website, email),,,,,Unknown,The public,2022-01-18,,,https://twitter.com/Mobi_Banka/status/1483440190270099467,https://archive.li/eeXrg,,,,
Serbian Opposition Politicians Receive Death Threats via Twitter,Two officials of the opposition Freedom and Justice Party, Marinika Tepić and Dragan Đilas, received death threats on Twitter in reply to Tepić’s tweet about a press release from mining giant Rio Tinto. Citizens across Serbia have been protesting against Rio Tinto’s proposed lithium mine, now officially on hold.,Fraud, threats and manipulations,Endangering security,Verbal attacks,Endangering security,Direct threats of violence, including threats of a sexual or physical nature,,,Unknown,Political subject,2022-01-22,,,https://rs.n1info.com/posts/marinika-tepic-i-dragan-djilas-dobili-pretnje-smrcu-na-tviteru,https://archive.li/Yj4FB,,,,
Smear Attacks on Media in Serbia Condemned,The Coalition for Media Freedom in Serbia has condemned smear campaigns and targeting of journalists, news outlets and media organisations from Vojvodina, such as Portal 021, Luftika, VOICE and the Independent Journalists’ Association of Vojvodina, by the NS Uživo website. This website has accused the individuals and organisations in question of links to organised crime. ,Fraud, threats and manipulations,Public misinformation,Creating fake content and accounts,Character assassination,Creating fake content and accounts,,,Unknown,Media sector,2022-01-28,,,http://www.ndnv.org/2022/01/28/koalicija-za-slobodu-medija-napadi-na-medije-i-organizacije-u-vojvodini-kao-nastavak-obracuna-sa-profesionalnim-novinarima-i-organizacijama/,https://archive.li/v0b6s,,,,
Serbian Op-ed Website Targeted by Cyber Attack,Serbian media outlet Peščanik had fended off a Distributed Denial of Service DDoS attack, designed to make its site unavailable. Its IT department said that on January 30, it detected unusually large traffic – around 2.4 million access requests. The site was kept active by Cloudflare protection. ,Cyber incidents,Disabled services,DoS/DDoS,,,,,Unknown,Media sector,2022-01-30,,,,,,,,
Serbian Bank Warns Customers of Phishing Scam,The Serbian branch of Raiffeisen Bank has warned its clients that false requests to customers to reactivate their mobile banking apps via email are fraudulent. The bank advised its clients who received such emails not to follow the instructions. ,Cyber incidents,Online scams,Fake resources (fake website, email),,,,,Unknown,The public,2022-02-01,,,,,,,,
Serbian Post Warns Citizens About Phishing Messages,Serbian Post has informed citizens that fraudulent messages were sent on its behalf via SMS and WhatsApp, asking people to make payments on a fake link in order to pick up shipments. It advised people not to open the fake link and not to enter any personal data.,Cyber incidents,Online scams,Fake resources (fake website, email),,,,,Unknown,The public,2022-02-03,,,https://www.posta.rs/cir/info/vest-detaljnije.aspx?ID=10925,https://archive.li/I80GA,,,,
Serbian Journalist Threatened, Insulted on Facebook,Serbian-based journalist Nedim Sejdinović received threats and insults via Facebook Messenger, which he has reported to the country’s Cybercrime Prosecution Office. Sejdinović is known for op-eds in which he criticizes the government, and comments on social problems.,Fraud, threats and manipulations,Endangering security,Verbal attacks,Endangering security,Direct threats of violence, including threats of a sexual or physical nature,,,Unknown,Media sector,2022-02-11,,,https://www.facebook.com/story.php?story_fbid=10223350725169033&id=1013150811&m_entstream_source=feed_mobile,,,,,
Serbian Politician Sues Podcast Hosts – Again,Aleksandar Šapić, the ruling Serbian Progressive Party vice-president and New Belgrade municipality president has again sued Nenad Kulačin and Marko Vidojković, hosts of the podcast “Dobar, loš, zao” (“The Good, The Bad, The Ugly”), seeking 350,000 Serbian dinars (around 3,000 Euros) for defamation. Šapić filed a first lawsuit against the show’s hosts in November 2021, demanding more than a million Serbian dinars in compensation because of the contents of their programme. ,Fraud, threats and manipulations,Limiting freedom of expression,Abuse of legal mechanisms,,,,,Authority figures,Media sector,2022-02-13,,,https://rs.n1info.com/posts/sapic-ponovo-tuzio-kulacina-i-vidojkovica,https://archive.li/vNQcD,,,,
Phishing Campaign Targeting Serbian Facebook Users,The National CERT of Serbia has warned Facebook users about a phishing campaign aimed at compromising their account credentials. Users are getting messages asking them: “Are you in this video?” which also contain a malicious link.,Cyber incidents,Online scams,Fake resources (fake website, email),,,,,Unknown,The public,2022-02-18,,,https://www.cert.rs/rs/obavestenje/786-Prevara-na-dru%C5%A1tvenoj-mre%C5%BEi-Meta-%28Facebook%29.html,https://archive.li/p0NLC,,,,
Serbian Minister Accused on Twitter of Causing Traffic Accident,Claims appeared on Twitter that Serbia’s Minister of Construction, Transport and Infrastructure, Tomislav Momirović, caused a traffic accident in which a person was injured. Momirović on Twitter denied that he caused the accident. ,Fraud, threats and manipulations,Public misinformation,Content manipulation,,,,,Unknown,Political subject,2022-02-20,,,https://twitter.com/TomaMomirovic/status/1495455779037589507?s=20&t=WlRRuQNqYSL7LXiq2tAVVA,https://archive.li/MAMSh,,,,
Serbian Journalist Threatened With Death on Twitter Over Srebrenica Remarks,Serbian journalist Nikola Krstić received death threats and insults on Twitter in response to his thread on the 1995 Srebrenica genocide in Bosnia. Krstić has reported the threats to the Independent Journalists’ Association of Serbia, IJAS.,Fraud, threats and manipulations,Endangering security,Verbal attacks,Limiting freedom of expression,Direct threats of violence, including threats of a sexual or physical nature,,,Unknown,Media sector,2022-02-20,,,https://www.facebook.com/nkrstic/posts/10223251641911885,https://archive.li/yMBDr,,,,
Serbian Fashion Retailer’s Instagram Account Taken Over,Serbian fashion retail company Mona had its official Instagram account taken over by unknown attackers. The account has not posted any content that might explain who is behind the attack. However, the profile description was changed to something written in Turkish. ,Cyber incidents,Overtaking control,Technical attacks,,,,,Unknown,Private sector,2022-02-21,,,,,,,,
Serbian NGO’s Twitter Account Taken Over to Insult Ukraine,The Twitter account Youth of JAZAS, a Serbian HIV prevention and support NGO, was taken over by an unauthorised person who published a tweet comparing Ukraine to AIDS, and stating the Russia is “the cure”. The next day, after regaining control of the account, Youth of JAZAS apologised for the tweet.,Cyber incidents,Overtaking control,Technical attacks,,,,,Unknown,Civilian sector,2022-02-25,,,https://twitter.com/PlaceSoft/status/1497296598593855493?t=lrYaGWW_0X02yi5oLoRJQg&s=09,https://twitter.com/OJazas/status/1497348486236454914?t=Ry0gv0RQgYkeoGRn1Spx6g&s=09,https://archive.ph/9spHN,,,
Serbian Media Wrongly Link Changes to Zagreb Philharmonic Program to Ukraine,Web portals in Serbia and the Western Balkans region have misinterpreted a change to the Zagreb Philharmonic program, concerning the works of Russian composer Tchaikovsky, connecting the changes to the war in Ukraine. The Philharmonic has denied that his compositions were removed because he was Russian, as online media outlets claimed.,Fraud, threats and manipulations,Public misinformation,Content manipulation,,,,,Media sector,The public,2022-02-26,,,https://www.istinomer.rs/facebook-provere/zagrebacka-filharmonija-nije-zbog-putina-skinula-cajkovskog-sa-repertoara/,https://archive.li/70jid,,,,
Serbian Bank Warns Of Scam Emails,The Serbian branch of Banca Intesa has warned their clients about fraudulent emails allegedly coming from the bank with malicious attachments. In earlier cases, the subject of such emails contained information about an alleged payment in euros.,Cyber incidents,Online scams,Fake resources (fake website, email),,,,,Unknown,The public,2022-02-28,,,https://twitter.com/banca_intesa/status/1498251888986365953?t=8fMGG1q_tDh9DfOXd8OI4Q&s=09,https://archive.li/Sb8Q5,,,,
Serbian Ruling Party MP Tweets Fake Swastika Photo from Ukraine,Vladimir Đukanović, MP for the ruling Serbian Progressive Party, posted a photo on Twitter in which a swastika has been added to a Ukrainian armoured vehicle. Fact-checking organisation FakeNews Tragač clarified that the photo was manipulated, and dated from 2014.,Fraud, threats and manipulations,Public misinformation,Content manipulation,,,,,Authority figures,The public,2022-03-06,,,https://fakenews.rs/2022/03/15/prilepljena-izjava-i-prilepljena-svastika/,https://twitter.com/adv_djukanovic/status/1500595057484832775,https://archive.li/u4GsN,,,
Serbian Bank Warns of Fake Facebook Offer,The Serbian branch of Banca Intesa issued a warning about false posts being spread about a fake Facebook page of the bank, saying that the bank will double the amount of money each client as in the bank if they share, comment and like the post.,Cyber incidents,Online scams,Fake resources (fake website, email),,,,,Unknown,The public,2022-03-07,,,https://twitter.com/banca_intesa/status/1500834951394168836,https://archive.li/6AbF3,,,,
Serbian Bank Warns of Account Fraud,The Serbian branch of Banca Intesa has warned its clients about fraudulent emails, allegedly coming from the bank, with information that their Intesa Sanpaolo account has been temporarily disabled, and urging clients to again submit their personal data. ,Cyber incidents,Online scams,Fake resources (fake website, email),,,,,Unknown,The public,2022-03-09,,,https://twitter.com/banca_intesa/status/1501499448425340936,https://archive.li/zuuTU,,,,
Serbian Bank Warns of Scam Emails about Russia,The Serbian branch of Banca Intesa has warned its clients about fraudulent emails allegedly coming from the bank, with malicious attachments. The subject of the emails is information about an alleged payment from Russia. ,Cyber incidents,Online scams,Fake resources (fake website, email),,,,,Unknown,The public,2022-03-10,,,https://twitter.com/banca_intesa/status/1501900415088144391,https://archive.li/iNUIO,,,,
Serbian Journalist Threatened With Death on Facebook for Ukrainian Refugee Interview,Danas correspondent Miljko Stojanović received death threats on Facebook after conducting an interview with a Ukrainian refugee in Serbia. Stojanovic reported the case to the police in Zaječar and informed the Independent Journalists’ Association of Serbia, IJAS. ,Fraud, threats and manipulations,Endangering security,Verbal attacks,Endangering security,Direct threats of violence, including threats of a sexual or physical nature,,,Unknown,Media sector,2022-03-12,2022-07-06,,https://www.danas.rs/vesti/drustvo/pretnje-smrcu-dopisniku-danasa-iz-zajecar-zbog-intervjua-sa-ukrajincem/,https://www.cenzolovka.rs/pritisci-i-napadi/policija-otkrila-ko-je-pretio-dopisniku-danasa-iz-zajecara/,https://archive.li/8KDFN,,,
Serbian Singer’s Instagram and Facebook Accounts Taken Over,The Serbian Singer at this year's Eurovision contest, Ana Đurić, “Konstrakta”, said her official Instagram and Facebook accounts had been breached and that she will try to recover them with the help of experts. ,Cyber incidents,Overtaking control,Technical attacks,,,,,Unknown,The public,2022-03-13,,,https://rs.n1info.com/showbiz/konstrakta-svi-nalozi-su-hakovani-umetnica-je-nevidljiva/,https://archive.li/Pv5Z6,,,,
Serbian Portal Loses Political Reporting Court Case,The Court of Appeals in Belgrade has ordered the Independent Journalists’ Association of Vojvodina, founder of Serbian news portal Autonomija, to pay compensation for defamation and court costs for reporting on a statement of the opposition Democratic Party from 2017. In the statement, the party had called for the dismissal of a high school principal in Novi Sad who filed a lawsuit about an article in Autonomija.,Fraud, threats and manipulations,Limiting freedom of expression,Abuse of legal mechanisms,,,,,Individual,Media sector,2022-03-18,,,,,,,,
Serbian TV Removes Video Criticising Govt from YouTube,TV station Happy, which has national coverage, removed a video from its morning programme which featured political analyst Boban Stojanović from its YouTube channel. In the programme, Stojanović was critical of the ruling Serbian Progressive Party, SNS.,Fraud, threats and manipulations,Self censorship,Content removal,,,,,Media sector,The public,2022-03-18,,,https://twitter.com/Radoholicar/status/1504951364480290818,https://twitter.com/nikolazstankovi/status/1504897219891281929,https://archive.li/3WCJQ,,,
Serbian Musician Discovers False Twitter Account,Serbian rapper Marko Šelić, known as Marčelo, discovered that a Twitter account with the username “marchelodefakto” had been impersonating him on Twitter for years. The fake account has been suspended.,Fraud, threats and manipulations,Public misinformation,Creating and sharing fake content,,,,,Public figures,The public,2022-03-21,,,https://twitter.com/MarkoShelic/status/1505703347382333451,https://archive.li/s7G3o,,,,
Serbian TV Host Threatened Over Fake Tweet About Albright,Serbian satirical portal Zicer shared an article in which it posted a fake tweet by Ivan Ivanović, a TV host known for criticism of the ruling party. In the fake tweet, Ivanović allegedly expressed condolences to the family of former US Secretary of State Madeleine Albright, who died in late March and was one of the key people behind the NATO bombing of then Yugoslavia in 1999. Ivanović claimed that he and his family had received numerous threats because of the false tweet.,Fraud, threats and manipulations,Public misinformation,Creating and sharing fake content,Character assassination,Creating and sharing fake content,,,Media sector,Media sector,2022-03-23,,,https://zicer.org/2022/03/23/ivan-ivanovic-poslao-telegram-saucesca-porodici-olbrajt-s-bolom-u-srcu-izrazavam-najiskrenije-saucesce/,https://twitter.com/veceivan/status/1507313737274908698,https://archive.li/eVSiz,,,
Fake Radio Television of Serbia Social Media Pages Created,Fake pages on Facebook and Instagram have been created on behalf of Serbian national broadcaster Radio-televizija Srbije, RTS, on which fake news and product offers on Amazon have been published. Abuses of the RTS logo were reported and many profiles have been shut down several times.,Fraud, threats and manipulations,Public misinformation,Creating and sharing fake content,,,,,Unknown,Media sector,2022-03-24,,,https://www.cenzolovka.rs/scena/lazne-stranice-sa-znakom-rts-a-na-fejsbuku-i-instagramu/,https://archive.li/r9YT8,,,,
Serbian Journalist Threatened via Facebook,Verica Marinčić, a Serbian journalist from Indjija working for IN medija portal, has reported threats via Facebook. She believes they are connected to an article she published about a local priest.,Fraud, threats and manipulations,Endangering security,Direct threats of violence, including threats of a sexual or physical nature,Limiting freedom of expression,Verbal attacks,,,Unknown,Media sector,2022-03-31,,,https://nuns.rs/novinarka-verica-marincic-posle-novih-pretnji-na-fejsbuku-nije-mi-svejedno-ne-znam-sta-je-sledece/,https://archive.li/c2y00,https://www.cenzolovka.rs/pritisci-i-napadi/godinu-dana-zatvora-odnosno-tri-godine-uslovno-za-pretnje-urednici-in-medija/,,,
Serbian News Agency Comes Under DDoS Attack,On April 1, the Beta News Agency website was made unavailable due to a DDoS attack, allegedly launched from abroad. It is not known who the attacker was. After the attack was stopped, the site became available again.,Cyber incidents,Disabled services,DoS/DDoS,,,,,Unknown,Media sector,2022-04-01,,,https://www.cenzolovka.rs/pritisci-i-napadi/hakerski-napadi-na-sajt-novinske-agencije-beta/,https://archive.li/Hzr1c,,,,
YouTube Removes Serbian Sports Journalist’s Channel,Serbian sports journalist Milojko Pantić said his YouTube channel, which also hosts political content critical of the current government, had been removed from the platform without explanation. Before the start of the electoral silence in Serbia ahead of the April 3 polls, Pantić had published a video about the elections.,Fraud, threats and manipulations,Limiting freedom of expression,Content filtering and automated moderation,,,,,Big tech,Media sector,2022-04-05,,,https://nuns.rs/snimci-emisije-milojka-pantica-izbrisani-sa-jutjuba-sumnjam-da-mi-je-vucic-ukinuo-kanal/,https://archive.ph/LaJGV,,,,
Complaints made Against Serbian Journalists and Activist Over Protests,Journalists of SO info portal Sara Mikić and Sava Majstorov and a local activist Danijel Mirkov, named as organisers of the protests and roadblocks against the Rio Tinto mining project in Serbia in December 2021, were targeted with misdemeanor complaints. Their own reports from the scene and social media posts were used in the complaints that police filed against them.,Fraud, threats and manipulations,Limiting freedom of expression,Abuse of legal mechanisms,,,,,Authority figures,Media sector,2022-04-13,,,https://www.soinfo.org/vesti/vest/26608/prekrsajne-prijave-protiv-novinara-i-aktiviste/,https://archive.ph/iVdWw,,,,
Vatican and Russia Twitter Joke Reported as News,Unverified information from a tweet that the Vatican Bank is buying rubles to buy Russian gas has spread in the Serbian media and worldwide. However, the tweet’s author tweeted later that it was a joke. The OilPrice.com portal that reports energy prices also denied the claim.,Fraud, threats and manipulations,Public misinformation,Content manipulation,,,,,Unknown,The public,2022-04-13,,,https://fakenews.rs/2022/04/13/mediji-naseli-na-saljivi-tvit-banka-vatikana-ne-kupuje-rublje-za-ruski-gas/,https://archive.li/OhHkJ,,,,
Serbian Daily Website Targeted by Cyber Attack,The online edition of Serbian daily Danas has faced cyber-attack attempts on its website for about 10 days. With technical support, the site continued to work smoothly. The attacks started on Saturday, April 16, but did not limit access to the website.,Cyber incidents,Disabled services,DoS/DDoS,,,,,Unknown,Media sector,2022-04-16,2022-04-29,,https://nuns.rs/portal-danas-rs-vise-od-10-dana-pod-organizovanim-hakerskim-napadima/,https://archive.li/2FJ9H,,,,
Threats sent to Serbian President on Instagram,Criminal proceedings have been initiated against a man suspected of threatening President Aleksandar Vučić on Instagram. The High Public Prosecutor’s Office in Belgrade – Special Department for Cybercrime – proposed his detention. The mas has allegedly admitted the crime, blaming it on his failure to take a prescribed therapy.,Fraud, threats and manipulations,Limiting freedom of expression,Abuse of legal mechanisms,Limiting freedom of expression,Verbal attacks,Endangering security,Direct threats of violence, including threats of a sexual or physical nature,Authority figures,The public,2022-04-16,,,https://rs.n1info.com/vesti/muskarac-priznao-pretnje-smrcu-vucicu-tuzilac-trazi-pritvor/,https://archive.li/nB3sx,,,,
Death threats to Serbian Journalists of N1 TV,The email address of the N1 portal received a threatening email, which according to the editorial office was just the latest in a series of threats sent to the journalists of this media outlet. The Safe Journalist network and Independent Journalists’ Association of Serbia called on the competent institutions to act and ensure the safety of journalists.,Fraud, threats and manipulations,Endangering security,Verbal attacks,Endangering security,Direct threats of violence, including threats of a sexual or physical nature,,,Unknown,Media sector,2022-04-18,,,https://rs.n1info.com/posts/nove-pretnje-smrcu-novinarima-televizije-n1,https://archive.li/hnvjC,,,,
Serbian Danas Journalists Threatened over Gandhi Quote,The inbox of the daily newspaper and portal Danas was flooded with threats reacting to the published quote, “Truth, not God”, by Mahatma Gandhi, published on the Instagram of the Danas portal. According to the Independent Journalists’ Association of Serbia, this was the sixth attack on journalists during that week, just before Easter.,Fraud, threats and manipulations,Endangering security,Verbal attacks,Endangering security,Direct threats of violence, including threats of a sexual or physical nature,,,Unknown,Media sector,2022-04-22,,,https://nuns.rs/sj-pretnje-smrcu-novinarima-danasa-sesti-napad-na-novinare-u-srbiji-za-nedelju-dana/,https://archive.li/fdeqN,,,,
Serbian Singer’s Easter Photo Marked ‘Sensitive’ By Twitter,Twitter marked a picture of the Easter card of the Serbian singer at Eurovision, Ana Đurić Konstrakta, as “potentially sensitive content”. It was implied that the tables on the photo resembled the letter “Z”, which is linked to support for Russia’s invasion of Ukraine.,Fraud, threats and manipulations,Limiting freedom of expression,Content filtering and automated moderation,,,,,Big tech,Public figures,2022-04-26,,,https://www.blic.rs/zabava/konstrakta-oznacena-kao-neprimerena-na-tviteru/bw73y2j,https://archive.li/L9KNb,,,,
Serbian Journalist and Family Threatened on Facebook,Journalist and program director of the Independent Journalists’ Association of Vojvodina, Dinko Gruhonjić, and his family were threatened on several occasions via Facebook. The union condemned the attacks and called on the authorities to take action.,Fraud, threats and manipulations,Endangering security,Verbal attacks,Endangering security,Direct threats of violence, including threats of a sexual or physical nature,,,Unknown,Media sector,2022-04-26,,,https://rs.n1info.com/vesti/ndnv-trazi-hitnu-reakciju-zbog-novih-pretnji-dinku-gruhonjicu/,https://archive.li/hfAoa,,,,
Serbian Singer Threatened by Stalker,Serbian singer Sandra Prodanović, known as Sandra Afrika, received threatening messages and calls from an unknown person from Osijek, Croatia, which she ignored for years. When the attacker started harassing her sister, family and friends, Sandra reported the case to the police and the suspect was arrested.,Fraud, threats and manipulations,Endangering security,Verbal attacks,Endangering security,Direct threats of violence, including threats of a sexual or physical nature,,,Unknown,Public figures,2022-04-26,,,https://www.kurir.rs/stars/3921473/jezive-pretnje-sandra-afrika,https://www.kurir.rs/stars/3921163/velika-ispovest-sandre-afrike-kroz-suze-o-uhapsenom-napadacu,https://www.kurir.rs/stars/3921919/sandra-afrika-progonitelj-hapsenje-skandal https://archive.li/8ovQS,,,
