Man Arrested for Threatening Police on Facebook,A 34-year-old man from the southern Serbian town of Leskovac has been arrested and faces criminal charges because of a post on Facebook in which, according to the official statement, he “threatened to use force against police officers if they try to undertake official actions against him during the curfew”. He is charged with attempting to prevent a public servant from performing an official act and will be detained for 48 hours – after which he will be brought before the public prosecutor in Leskovac to hear the criminal charges.,Fraud, threats and manipulations,Limiting freedom of expression,Abuse of legal mechanisms,,,,,Authority figures,The public,2020-03-30,,,https://www.juznevesti.com/Hronika/Uhapsen-Leskovcanin-zbog-pretnji-policiji-na-Fejsbuku.sr.html,http://archive.li/dVTnm,,,,
Doctor Target of Misogyny on Social Media,Deputy Director of the Institute for Public Health of Serbia Dr Darija Kisic Tepavcevic, one of Serbia’s main experts on the COVID-19 response, has been targeted with misogynistic insults on social media, mainly commenting on her appearance. The insults have been condemned by Serbia’s Equality Commissioner.,Fraud, threats and manipulations,Discrimination and hate speech,Attacks based on gender and sexual characteristics,,,,,Individual,Public figures,2020-03-31,,,http://rs.n1info.com/Vesti/a584020/Poverenica-i-ministarka-osudile-uvredljive-komentare-o-Dariji-Kisic-Tepavcevic.html,http://archive.li/flkno,,,,
Journalist Arrested for Article about Hospital Conditions,A journalist from the media outlet Nova S portal was arrested at her home on Wednesday over a text she wrote on allegedly bad working conditions and the lack of protective equipment for medical staff during the COVID-19 pandemic in the Vojvodina Clinical Centre. She was detained for 48 hours in police custody. Police intervened after the hospital issued a statement accusing the journalist of spreading false information about conditions in the clinic and of “disturbing the public and damaging the reputation of the health institution”.,Fraud, threats and manipulations,Limiting freedom of expression,Abuse of legal mechanisms,,,,,Authority figures,Media sector,2020-04-01,2020-04-20,Novinarka uhapšena, policija joj je zaplenila dva telefona i racunar. Iz pritvora je puštena 2. aprila. Osnovno javno tužilaštvo u Novom Sadu je krajem aprila odbacilo krivicnu prijavu protiv Ane Lalic.,Novinarka uhapšena, policija joj je zaplenila dva telefona i racunar. Iz pritvora je puštena 2. aprila. Osnovno javno tužilaštvo u Novom Sadu je krajem aprila odbacilo krivicnu prijavu protiv Ane Lalic.,,,,,
Opposition Leader Threatened on Facebook, Suspect Arrested, Freedom and Justice Party chairman Dragan Đilas has been threatened via Facebook. Police have arrested a man from Belgrade on suspicion of threatening Đilas from his father's Facebook profile and thereby committing the crime of endangering security.,Fraud, threats and manipulations,Endangering security,Direct threats of violence, including threats of a sexual or physical nature,,,,,Individual,Political subject,2020-04-01,,Osumnjiceni uhapšen, odredeno mu je zadržavanje do 48 sati.,Osumnjiceni uhapšen, odredeno mu je zadržavanje do 48 sati.,,,,,
NCD Website under DDoS Attack,Website of the National Coalition for Decentralization (nkd.rs) was under DDoS attacks. The site received over 700.000 access requests from more than 3000 foreign IP addresses. The greatest number of requests came from Indonesia, Russia, Brazil and Thailand.,Cyber incidents,Disabled services,DoS/DDoS,,,,,Unknown,Civilian sector,2020-04-03,,,https://nkd.rs/2020/04/03/ddos-napadi-na-sajt-nkd-a/,http://archive.li/aSzUd,,,,
False Pandemic Facebook Page Attacks Journalist,Nova S journalist Ana Lalić was targeted with a sponsored Facebook post on the Facebook page “COVID 19 Serbia”, which is not the official page of the pandemic response. Among other things, the post claimed that “she spread false news on the lack of equipment and medicine in the Vojvodina Clinical Centre” and that she was an example of “ultimate unprofessionalism”.,Fraud, threats and manipulations,Character assassination,Verbal attacks,Public misinformation,Creating and sharing fake content,,,Unknown,Media sector,2020-04-03,,,,,,,,
Municipal Website Publishes Personal Data of an Infected Person,The municipality of Sid in northern Serbia published the personal data of a citizen confirmed as infected with COVID-19. The person’s initials, age, street address and workplace were published on the municipal website.,Privacy and data protection,Disclosure of data,Website posting (including public registries and platforms),,,,,Responsible person from the public sector,Mass casualty,2020-04-05,,Poverenik za informacije od javnog znacaja i zaštitu podataka o licnosti pokrenuo je postupak nadzora povodom ovog slucaja.,https://www.021.rs/story/Info/Vojvodina/239302/Sid-objavio-adresu-i-druge-licne-podatke-obolele-od-virusa-korona-Poverenik-pokrece-nadzor.html,http://archive.li/rAQ0V,,,,
Assistant to Mayor of Novi Pazar Removed from Duty after Critical Facebook Post,Emir Ašćerić, the Mayor of Novi Pazar’s assistant, was removed from his position, after criticising Serbian President Aleksandar Vučić’s visit to the city to deliver medical equipment on Facebook.,Fraud, threats and manipulations,Limiting freedom of expression,Cyber-mobbing	Retaliation,,,,,Authority figures,Political subject,2020-04-07,,,https://www.krik.rs/smena-pomocnika-gradonacelnika-novog-pazara-zbog-kritike-vuciceve-posete/,http://archive.li/gw5PF,,,,
Serbia’s Ruling Rarty Sues over “Fake News” Report,The branch of the ruling Serbian Progressive Party in Sabac, said its party commissioner in the town, Boban Birmancevic, had filed a criminal complaint against the newspaper Podrinske and its journalist, Hanibal Kovac, for “spreading fake news” and “spreading panic”. The party press release said that “lies that members of the Serbian Progressive Party have spread coronavirus around the town could have serious consequences for citizens”.,Fraud, threats and manipulations,Limiting freedom of expression,Abuse of legal mechanisms,,,,,Political subject,Media sector,2020-04-07,,,https://sabac.sns.org.rs/novosti/saopstenja/saopstenje-za-javnost-49,http://podrinske.com/podneta-krivicna-prijava-protiv-podrinjskih-novina/,http://archive.li/Dee51,,,
Kurir Tabloid Attacks N1 TV,The Serbian tabloid newspaper Kurir has accused journalists of N1 television of manufacturing falsehoods and spreading panic and therefore “undermining the credibility of the healthcare system”.,Fraud, threats and manipulations,Character assassination,Verbal attacks,Public misinformation,Creating and sharing fake content,,,Media sector,Media sector,2020-04-08,,,https://archive.li/WUxmj,,,,,
Threats to Direktno.rs Newsroom by Email,The newsroom of Direktno.rs news portal received an email containing a murder threat to journalists.,Fraud, threats and manipulations,Endangering security,Direct threats of violence, including threats of a sexual or physical nature,,,,,Unknown,Media sector,2020-04-08,,Pretnja je prijavljena MUP-u.,Pretnja je prijavljena MUP-u.,,,,,
Pandemic Information System Left Exposed Online, Login credentials for COVID-19, Serbia’s information system for entry, analysis and storage of health data during the pandemic, were made publicly available on the website of a health institution for eight days. SHARE Foundation researchers stumbled on the page while searching for information about the new legal framework for personal data processing in response to the pandemic. Relevant state authorities were notified and further access was disabled promptly.,Privacy and data protection,Data leakage,Curenje na veb sajtu (uključujući javne registre i platforme) ,,,,,Responsible person from the public sector,Mass casualty,2020-04-09,2020-04-17, Poverenik za informacije od javnog znacaja i zaštitu podataka o licnosti ce pokrenuti postupak nadzora.,https://www.sharefoundation.info/sr/pandemija-jedne-lozinke/,https://www.rtv.rs/sr_lat/drustvo/poverenik-nadzor-zbog-kompromitovanja-podataka-o-obolelima_1115887.html,http://archive.li/lE39L,,,
Fake Facebook Pandemic Page Targets N1 TV,The N1 television station was targeted by a post on a Facebook page called ‘COVID 19 Serbia’, which is not the official pandemic response page. The post alleged that N1 is “leading a campaign against the Army of Serbia and the healthcare system” and that it “uses every opportunity to humiliate Serbia”.,Fraud, threats and manipulations,Character assassination,Verbal attacks,Public misinformation,Creating and sharing fake content,,,Unknown,Media sector,2020-04-10,,,,,,,,
Fake Facebook Pandemic Page Accuses Activist,Radomir Lazovic, an activist from the “Don't Let Belgrade D(r)own” campaign, was accused of “zoophilia” in a post on a Facebook page called ‘COVID 19 Serbia’, which is not the official pandemic response page. A private photo of Lazovic was also included in the post.,Privacy and data protection,Disclosure of data,Website posting (including public registries and platforms),,,,,Unknown,Individual casualty,2020-04-13,,,,,,,,
Fake Facebook Pandemic Page Accuses Activist,Radomir Lazovic, an activist from the “Don't Let Belgrade D(r)own” campaign, was accused of “zoophilia” in a post on a Facebook page called ‘COVID 19 Serbia’, which is not the official pandemic response page. A private photo of Lazovic was also included in the post.,Fraud, threats and manipulations,Character assassination,Verbal attacks,Public misinformation,Creating and sharing fake content,Public misinformation,Distribution of content without consent,Unknown,Civilian sector,2020-04-13,,,,,,,,
Facebook Video Smears Serbian Journalist,A Facebook page entitled Javnost Srbije (Serbian Public) published a video smearing Nova S website journalist Ana Lalić over her story about poor working conditions in one Serbian hospital. The page also used online ads to promote its content aimed disparaging at Ana Lalić.,Fraud, threats and manipulations,Limiting freedom of expression,Verbal attacks,,,,,Unknown,Media sector,2020-04-13,,,https://archive.li/wUNXa,https://archive.li/h9iwJ,,,,
Serbian ISP Suffers Technical Attack,Serbia Broadband, SBB, one of the largest telecom providers in Serbia, stated that its servers came under cyber-attacks that caused problems with their internet service. The company noted that during the attack on its network, some users received messages from Telekom Serbia, a state-controlled company, spreading what it called “scandalous falsehoods about SBB”.,Cyber incidents,Disabled services,DoS/DDoS,,,,,Unknown,Private sector,2020-04-15,,,https://sbb.rs/a76132/podrska/vesti-i-informacije/SBB-obavestenje-smetnje-u-radu-interneta-posledica-sajber-napada.html,http://archive.li/NaOAd,,,,
Serbian Police Warn Public about Email Scam,Serbia’s Interior Ministry has warned the public about an email scam to infect devices with Trojan malware. A fraudulent email informs people they have been summoned by the police over an ongoing investigation, and tells them to take a look at attached documents that contain the malware. ,Cyber incidents,Online scams,Fake resources (fake website, email),Compromised data,Malware (malicious software, virus),,,Unknown,The public,2020-04-15,,,http://mup.gov.rs/wps/portal/sr/!ut/p/z1/04_Sj9CPykssy0xPLMnMz0vMAfIjo8zi_S19zQzdDYy83c1cjQwcA80tXbxdLYwtPAz0w_Wj9KOASgxwAEcD_eDiovig4Hhln8SSPP2C7LxyAITcRCg!/?1dmy&urile=wcm%3Apath%3A%2Fpublic_latin%2Fpocetna%2Faktuelno%2Fsaopstenja%2F5e652e1e-165e-4723-a664-c3eddf920bf4,http://archive.li/xAyKZ,,,,
Serbian Doctor and Journalist Smeared on Facebook, Radio Valjevo, a local radio station in Serbia, published a Facebook post in which it smeared a local doctor and accused her of “criminal activities”, also mentioning her alleged connections with an editor of a local news website, who they insulted.,Fraud, threats and manipulations,Character assassination,Verbal attacks,Public misinformation,Creating and sharing fake content,,,Media sector,The public,2020-04-16,,,https://twitter.com/djdjokovic/status/1251155300129767426?s=19,http://archive.li/ve1ZP,,,,
Belgrade Deputy Mayor Insults Journalist on Facebook, Goran Vesić, the deputy mayor of Belgrade, accused former BIRN journalist Ana Novakovic of being “[opposition politician Dragan] Đilas’s journalist” after she questioned in a Twitter post the transfer of President Aleksandar Vučić’s son to a temporary hospital for COVID-19 patients located at the Belgrade Fair.,Fraud, threats and manipulations,Character assassination,Verbal attacks,Public misinformation,Creating and sharing fake content,,,Political subject,Media sector,2020-04-18,,,https://twitter.com/Ann_Novakovic/status/1251535935134711809?s=19,https://www.facebook.com/Goran.Vesic.zvanicna.stranica/posts/3365952980099251,http://archive.li/wqaN9,,,
Serbian Epidemiologist Threatened for Backing Vaccination,Epidemiologist Predrag Kon was targeted by numerous threats and insults on Facebook after he claimed that the coronavirus pandemic could only be suppressed by vaccination.  ,Fraud, threats and manipulations,Limiting freedom of expression,Verbal attacks,Endangering security,Direct threats of violence, including threats of a sexual or physical nature,,,Individual,Public figures,2020-04-24,,,http://rs.n1info.com/Vesti/a592469/Pretnje-Konu-na-drustvenim-mrezama-nakon-zalaganja-za-vakcinu.html,http://archive.li/doqbs,,,,
N1 TV Journalist Targeted by Sexist Tweet,Dragan J. Vučićevic, editor-in-chief and owner of Informer, a pro-government Serbian tabloid, tweeted a photo of N1 TV journalist Žaklina Tatalović with a sexist remark. His action was condemned by the Equality Commissioner of Serbia.,Fraud, threats and manipulations,Discrimination and hate speech,Attacks based on gender and sexual characteristics,Character assassination,Distribution of content without consent,,,Media sector,Media sector,2020-04-24,,,Glavni i odgovorni urednik Informera Dragan J. Vucicevic pravnosnažno je osuden na novcanu kaznu od 200.000 dinara. Ukoliko kazna ne bude isplacena u roku od tri meseca, bice zamenjena kaznom zatvora.,,,,,
Local Radio Station Suffers Technical Attack,The website of Radio 021 from Novi Sad came under a technical attack, resulting in the slow loading of content. It appears that the options for liking and disliking user comments were the principal targets.,Cyber incidents,Disabled services,DoS/DDoS,,,,,Unknown,Media sector,2020-05-01,,,https://www.021.rs/story/Novi-Sad/Vesti/242163/Normalizovan-rad-Portala-021-nakon-hakerskog-napada.html,http://archive.li/wYgxk,,,,
Tabloid Attacks Investigative Portal CINS,The pro-government tabloid Informer published an insulting article on its website aimed at the Center for Investigative Journalism of Serbia, CINS, after CINS had published a story about how the private plane of Željko Mitrovic, owner of the pro-government TV station Pink TV, was sent without a permit on a flight to Moscow to retrieve medical supplies.,Fraud, threats and manipulations,Character assassination,Verbal attacks,Public misinformation,Creating and sharing fake content,,,Media sector,Media sector,2020-05-01,,,https://www.cins.rs/fantomski-let-kompanije-zeljka-mitrovica-za-moskvu/,https://informer.rs/vesti/drustvo/514347/dokle-doseze-vasa-bolest-cins-napao-zeljka-mitrovica-jer-poslao-privatni-avion-medicinsku-pomoc-spas-zivota-gradjana-srbije,http://archive.li/l8qf6#selection-3619.18-3622.0,,,
Journalist Threatened after Crisis HQ Press Conference,After she put a question to Health Minister Zlatibor Loncar at a press conference of the pandemic crisis HQ, the editor of Jedinstvo newspaper Rada Komazec received numerous threats and insults on social media. ,Fraud, threats and manipulations,Character assassination,Verbal attacks,Endangering security,Direct threats of violence, including threats of a sexual or physical nature,,,Individual,Media sector,2020-05-02,,,http://www.uns.org.rs/sr/saopstenja/98111/uns-policija-i-tuzilastvo-da-utvrde-ko-preti-radi-komazec.html,http://archive.li/ItOqR,,,,
Tabloid Editor Insults CINS Journalists on Twitter,Dragan J. Vučićevic, editor and owner of the pro-government tabloid Informer, published insulting tweets about the editor of the Center for Investigative Journalism of Serbia, CINS, Milica Saric, and the journalist Vladimir Kostic. The attack occurred after CINS published a story about how the private plane of Željko Mitrovic, owner of pro-government TV station Pink TV, was sent without a permit on a flight to Moscow to retrieve medical supplies.,Fraud, threats and manipulations,Character assassination,Verbal attacks,,,,,Media sector,Media sector,2020-05-02,,,https://twitter.com/djvucicevic/status/1256647982449152001?s=19,https://twitter.com/djvucicevic/status/1256943799416348672,https://archive.li/J3Iel,,,
Racist Attack on Migrant Centre Livestreamed in Serbia,According to media reports, a 20-year-old Serbian man breached the fence of a migrant centre in Belgrade suburb Obrenovac with his car, burst into the building and shouted racist remarks at migrants. He livestreamed the attack on Facebook.,Fraud, threats and manipulations,Endangering security,Direct threats of violence, including threats of a sexual or physical nature,Discrimination and hate speech,Verbal attacks,,,Individual,The public,2020-05-06,,,http://rs.n1info.com/Vesti/a596797/Kolima-probio-ogradu-i-uleteo-u-Prihvatni-centar-za-migrante-u-Obrenovcu.html,http://archive.li/ydMsw,,,,
Man Arrested Over Twitter Threats to President Vučić,Operatives of the Security Information Agency, SIA, arrested a man aged 48 after he was suspected of repeatedly calling for the murder of President Aleksandar Vučić on Twitter.,Fraud, threats and manipulations,Endangering security,Direct threats of violence, including threats of a sexual or physical nature,,,,,Individual,Political subject,2020-05-06,,Osumljiceni priveden i odredeno mu je zadržavanje do 48 sati.,Osumljiceni priveden i odredeno mu je zadržavanje do 48 sati.,,,,,
Journalist Gets Death Threats via Instagram Message,A Vreme weekly journalist and assistant to the editor-in-chief, Jovana Gligorijevic, received a threatening message on Instagram, which contained a death threat.,Fraud, threats and manipulations,Endangering security,Direct threats of violence, including threats of a sexual or physical nature,,,,,Individual,Media sector,2020-05-08,,Pretnja je prijavljena Posebnom tužilaštvu za visoko-tehnološki kriminal u Beogradu. Osumnjiceni uhapšen 11. maja 2020. u Novom Sadu.,Pretnja je prijavljena Posebnom tužilaštvu za visoko-tehnološki kriminal u Beogradu. Osumnjiceni uhapšen 11. maja 2020. u Novom Sadu.,,,,,
Man in Custody for “Spreading Panic” on Social Media,Media reports said a man from the town of Loznica was held in custody for 50 days and had his electronic devices confiscated – and is now under house arrest until proceedings against him are concluded. He was accused of spreading panic on Twitter by publishing claim,Fraud, threats and manipulations,Limiting freedom of expression,Abuse of legal mechanisms,,,,,Authority figures,The public,2020-05-09,,Osumnjiceni je stavljen u kucni pritvor do okoncanja pravnog postupka.,Osumnjiceni je stavljen u kucni pritvor do okoncanja pravnog postupka.,,,,,
Twitter Threats to Journalists and Opposition Politicians, An anonymous Twitter user threatened BIRN Serbia journalist Slobodan Georgiev, Serbian TV host Ivan Ivanović and Serbian opposition politicians Dragan Đilas and Boško Obradović. According to the Independent Journalists’ Association of Serbia, the suspect was promptly arrested.,Fraud, threats and manipulations,Endangering security,Direct threats of violence, including threats of a sexual or physical nature,,,,,Unknown,Media sector,2020-05-14,,Osumnjiceni je uhapšen.,Osumnjiceni je uhapšen.,,,,,
Srpska Lista Publishes Unfounded Accusations Against Journalist, Voice of America correspondent Budimir Ničić was targeted with unfounded accusations of being “unprofessional” by Srpska Lista, a Kosovo Serb political party backed by the government of Serbia. The party published a statement on its Facebook page after Ničić’s story about a poor single mother in Kosovo had been aired, describing it as “part of a propaganda war”.,Fraud, threats and manipulations,Character assassination,Verbal attacks,,,,,Political subject,Media sector,2020-05-17,,,https://kossev.info/uns-trazimo-da-se-srpska-lista-izvini-novinaru-budimiru-nicicu-zbog-neosnovanih-optuzbi/,http://archive.li/YWluo,,,,
Malicious Link Sent to Activist from Fake Email,The Twitter activist behind the account @XudRobin, who recently published information about the ruling Serbian Progressive Party’s internet team, was sent suspicious links via email. One was sent from a fake email address, claiming to be from the Center for Investigative Journalism, CINS.,Cyber incidents,Online scams,Fake resources (fake website, email),,,,,Unknown,Media sector,2020-05-18,,,https://twitter.com/XudRobin/status/1262356062684033025,https://archive.li/QHBir,,,,
Phishing Campaign Through Fraudulent Bank Emails,Phishing emails, allegedly sent by two Serbian banks, Banca Intesa and AIK Bank, have been noticed in Serbia. The emails contain dangerous malware. A similar phishing campaign occurred in December 2019.,Cyber incidents,Online scams,Fake resources (fake website, email),,,,,Unknown,The public,2020-05-19,,,https://www.it-klinika.rs/blog/upozorenje-banca-intesa-i-aik-banka-phishing,http://archive.li/H3Kzt,,,,
Journalist Received Death Threats by Phone,Milos Vuckovic, editor of workers’ rights portal Radnik.rs, said he received a phone call from a man threatening to kill him, claiming he “already slaughtered guys like him in the war”. ,Fraud, threats and manipulations,Endangering security,Direct threats of violence, including threats of a sexual or physical nature,,,,,Individual,Media sector,2020-05-19,,Vuckovic je prijavio pretnju i dao izjavu u policiji.,Vuckovic je prijavio pretnju i dao izjavu u policiji.,,,,,
Serbian Politician Calls Journalists ‘Associates of Security Agencies’ on Twitter,The President of Serbia’s Liberal Democratic Party, Cedomir Jovanović, wrote on Twitter that there is a journalist from the newsroom of the local weekly magazine, Nedeljnik, working for the country’s security agencies. The magazine had previously published excerpts from an upcoming book on a former high-ranking official from the Security Information Agency. ,Fraud, threats and manipulations,Character assassination,Verbal attacks,Public misinformation,Creating and sharing fake content,,,Political subject,Media sector,2020-05-23,,,http://www.uns.org.rs/sr/saopstenja/99075/uns-cedomir-jovanovic-da-se-izvini-novinarima-nedeljnika.html,http://archive.li/UnSwA,,,,
Serbian Local News Site Disabled After Cyberattack,Local news site Indjija Cafe, which had previously been targeted by cyberattacks to gain access to its administration panel, was completely disabled after another serious cyberattack in April. The site is now in the process of moving to a different web server.,Cyber incidents,Disabled services,DoS/DDoS,Overtaking control,Technical attacks,,,Unknown,Media sector,2020-05-25,,,https://www.cenzolovka.rs/pritisci-i-napadi/hakeri-srusili-portal-indjija-kafe-novinari-ne-odustaju/,http://archive.li/hI4ds,,,,
Phishing Campaign Exploits Demand for Protective Equipment,A phishing campaign claiming to offer to distribute personal protective equipment has been running in Serbia. Fraudulent emails were sent by someone claiming to be an employee of Serbia’s Institute of Public Health, one of the institutions handling the COVID-19 pandemic in the country, and contained a malicious attachment.,Cyber incidents,Online scams,Phishing campaign, identity theft, malware dissemination,,,,,Unknown,The public,2020-06-01,,,https://twitter.com/bachi83/status/1267427448951582721,https://archive.li/1c5wV,,,,
Local Correspondent Targeted with Insults in Online Comments,Zoran Radovanović, a correspondent of the daily Danas from Kragujevac, was insulted and vilified in the comments section on portals Danas and Glas Sumadije (Voice of Sumadija) because of his reporting on the situation in a local weapons factory.,Fraud, threats and manipulations,Limiting freedom of expression,Verbal attacks,,,,,Individual,Media sector,2020-06-03,,,https://www.cenzolovka.rs/pritisci-i-napadi/dopisnik-danasa-iz-kragujevca-izlozen-vredjanju-i-klevetama-zbog-tekstova-o-fabrici-oruzja/,http://archive.li/Wdtgv,,,,
N1 TV Website and Application Unavailable,The website of the regional TV station N1 and its mobile app were unavailable due to a technical attack on their systems. The outage was caused by an unusually large number of access requests, similar to attacks on the N1 website which occurred in January 2020.,Cyber incidents,Disabled services,DoS/DDoS,,,,,Unknown,Media sector,2020-06-04,,,http://rs.n1info.com/Vesti/a606531/Novi-napad-na-sajt-N1.html,http://archive.li/LqA81,,,,
Researcher Receives Twitter Threats after TV Appearance,Zoran Gavrilovic, a researcher at the Bureau for Social Research, BIRODI, received numerous threats of violence and insults after his TV appearance with a member of the Council of the Regulatory Body for Electronic Media.,Fraud, threats and manipulations,Limiting freedom of expression,Verbal attacks,Endangering security,Direct threats of violence, including threats of a sexual or physical nature,,,Media sector,Civilian sector,2020-06-04,,,http://rs.n1info.com/Vesti/a606407/Zoranu-Gavrilovicu-stizu-pretnje-posle-gostovanja-na-N1.html,http://archive.li/ZlsiA,,,,
