Journalist Radomir Počuča called for lynching Women in Black via Facebook,Journalist Radomir Počuča called for lynching Women in Black via Facebook just before this organization marked the 15th anniversary of crimes against Albanian civillians in Kosovo. Belgrade's Court of Appeals released him from all charges in 2017.,Fraud, threats and manipulations,Endangering security,Direct threats of violence, including threats of a sexual or physical nature,,,,,Media sector,Civilian sector,2014-03-26,2017-06-09,Pravnosnažno je osloboden 2017. godine,http://www.kurir.rs/crna-hronika/pocinje-sudenje-radomiru-pocuci-clanak-1476337,http://www.telegraf.rs/vesti/1164567-pocuca-zalim-zbog-svojih-reci-ne-i-zbog-svog-stava,https://www.blic.rs/vesti/hronika/apelacioni-sud-odlucio-da-pocuca-nije-ugrozio-sigurnost-zena-u-crnom/5y1sd76,,,
2014 floods − Text unavailable on portal Vaseljenska, where it was also published,The text "Appeal to Vučić to Stop Being Pathetic and Self-Pitying" which appeared on Teleprompter was erased without any explanation by this news portal. The editorial team confirmed that the website had been attacked during previous days.,Cyber incidents,Overtaking control,Technical attacks,,,,,Unknown,Media sector,2014-04-17,2014-04-18,,,,,,,
2014 floods  − Teleprompter unavailable,RTV Mars from Valjevo announced that an amateur video from Krupanj showing a verbal attack against Minister Selakovic which they broadcast, as well as several texts they published on their website, resulted in violent threats and various forms of cyberattacks.,Cyber incidents,Overtaking control,Technical attacks,,,,,Unknown,Media sector,2014-05-17,2014-05-23,,,,,,,
2014 floods  − Teleprompter unavailable,RTV Mars from Valjevo announced that an amateur video from Krupanj showing a verbal attack against Minister Selakovic which they broadcast, as well as several texts they published on their website, resulted in violent threats and various forms of cyberattacks.,Fraud, threats and manipulations,Endangering security,Direct threats of violence, including threats of a sexual or physical nature,Limiting freedom of expression,Direct threats of violence, including threats of a sexual or physical nature,,,Unknown,Media sector,2014-05-17,2014-05-23,,,,,,,
2014 floods − Portal 'Druga Strana' became unavailable,After publishing the article "Dear State, We Shouldn't Take Any More of Your Time", the website Druga Strana became unavailable The author later said that the website was temporarily shut down owing to a "large attack" in order not to compromize the safety of other websites on the server (this is probably the explanation and decision of the provider).,Cyber incidents,Disabled services,DoS/DDoS,,,,,Unknown,Media sector,2014-05-18,2014-05-19,,http://www.drugastrana.net/svakodnevica/drzavo-ne-bismo-te-vise-zadrzavali/,https://twitter.com/N_Milosavljevic/status/468643495016923136,,,,
2014 floods − Critical text removed from Kolumnist portal,Article "A Short Introduction to Dictatorship", published on portal Kolumnista (Eng. Columnist) during the flood, was temporarily unavailable.,Cyber incidents,Disabled services,DoS/DDoS,,,,,Unknown,Media sector,2014-05-19,2014-05-20,,http://kolumnista.com/kratak-uvod-u-diktaturu/,https://archive.li/d5dlE,,,,
2014 floods − Social media users brought in for questioning over spreading panic,Media reported that people from Belgrade and other parts of Serbia were brought in for questioning over allegedly "spreading panic" via blog posts and social media accounts. The issue was their alleged speculation regarding the number of casualties and the extent of damage during the floods, about which there was no official information for days.,Fraud, threats and manipulations,Limiting freedom of expression,Abuse of legal mechanisms,,,,,Authority figures,The public,2014-05-21,2014-06-13,,http://www.cins.rs/srpski/news/article/ispovesti-uhapsenih-zbog-komentara-na-fejsbuku,https://archive.li/CMA4Q,,,,
Cyberattacks against Peščanik − plagiarized doctoral dissertation affair,A few hours after publishing a text about the plagiarized doctoral dissertation of the Minister of Police, the website was hacked. According to administrators, the website has occasionally been under attack for years. Brute-force attacks continued during the week, especially when a few days later the portal published a text on the non-existent doctoral dissertation of Mica Jovanović, the Rector of Megatrend University.,Cyber incidents,Disabled services,DoS/DDoS,,,,,Unknown,Media sector,2014-06-01,2014-06-08,,http://www.b92.net/info/vesti/index.php?yyyy=2014&mm=06&dd=03&nav_id=856389,http://www.blic.rs/Vesti/Drustvo/471699/Ponovo-oboren-sajt-Pescanika,https://archive.li/gZ861,,,
Cyberattacks against "Two in One",Two journalists' blog was hacked several times. According to the bloggers, the attacker was hidden using IP adresses located in Ukraine and China. A lawsuit against unknown persons was filed.,Cyber incidents,Disabled services,DoS/DDoS,,,,,Unknown,Media sector,2014-06-01,2014-06-07,,http://www.uns.org.rs/saopstenja/24886/uns--tuzilastvo-da-utvrdi-ko-napada-blog-dvaujedan-rs.html,https://archive.li/AOIkc,,,,
Reporter of RTV Mladenovac brought in for questioning over text sharing on Facebook,A reporter of RTV Mladenovac was brought in for questioning because he posted a critical comment from the website Kolumnist on his Facebook profile. The comment was about the Serbian Progressive Party official and Belgrade city manager Goran Vesić and his statement that the evaucated 1 of Obrenoac caused damage to Belgrade hotels worth 100,000 EUR.,Fraud, threats and manipulations,Limiting freedom of expression,Abuse of legal mechanisms,,,,,Authority figures,Media sector,2014-06-06,,,http://nuns.rs/info/statements/21973/efj-osudila-hapsenje-novinara-zbog-kritike-na-fejsbuku.html,http://www.novimagazin.rs/vesti/nuns-i-uns-protestuju-zbog-privodjenja-novinara,https://archive.li/e3iTg,,,
Miljane Radivojevic's private email correspondence revealed to public,Miljana Radivojevic's private correspondence with the former rector of Belgrade University concerning the plagiarized doctoral dissertaion of Megatrend University's rector was sent to some media and Megatrend's rector himself, who read parts of this correspondence in various TV programs.,Privacy and data protection,Disclosure of data,Publication in the media,,,,,Unknown,Individual casualty,2014-06-15,,Podneta krivicna prijava protiv Mice Jovanovica.,http://www.rts.rs/page/stories/sr/story/125/Dru%C5%A1tvo/1640371/Prijava+protiv+Mi%C4%87e+Jovanovi%C4%87a.html,http://www.balkaninsight.com/en/article/anonymous-denied-hacking-allegations,https://archive.li/HdabZ,,,
Businessman from Ruma threatened Telegraf reporter with physical assault,A company owner from Ruma verbally assaulted an anonymous Telegraf reporter, threatened with violence and a lawsuit over a text about his business arrangements with a local police officer.,Fraud, threats and manipulations,Endangering security,Direct threats of violence, including threats of a sexual or physical nature,Limiting freedom of expression,Abuse of legal mechanisms,,,Individual,Media sector,2014-06-19,,,http://www.nuns.rs/info/news/22048/preceno-novinaru-telegrafa.html,https://archive.li/keQtD,,,,
Cyberattacks against Kurir website in June 2014,A series of cyberattacks started after the football World Cup match Croatia−Mexico. The attacks allegedly mostly came from Croatia, so investigation was requested thorugh Interpol office in Zagreb.,Cyber incidents,Disabled services,DoS/DDoS,,,,,Unknown,Media sector,2014-06-23,2014-06-26,,http://www.kurir.rs/mup-u-toku-istraga-o-napadu-na-kurir-clanak-1434353,http://www.rtv.rs/sr_lat/drustvo/hrvatska-policija-obavestena-o-hakerskim-napadima-na-kurir_498605.html,https://archive.li/Ht7Nf,,,
Smederevo's municipal council member offended and threatened journalists,On his Facebook account, Smederevo's municipal council member offended and threatened journalists who reported about his arrest.,Fraud, threats and manipulations,Endangering security,Direct threats of violence, including threats of a sexual or physical nature,Endangering security,Verbal attacks,,,Authority figures,Media sector,2014-07-05,,,http://www.sdcafe.rs/vesti/uns-policija-i-tuzilastvo-da-ispitaju-navode-o-pretnjama-milana-lukica-novinarima,http://www.uns.org.rs/desk/Pisma/25440/prijava-smederevskih-novinara-protiv-clana-gradskog-veca.html,https://archive.li/9DY5Y,,,
Activist from Obrenovac threatened via Facebook,Deputy president of the Municipality of Obrenovac threatened a local Twitter activist via his Facebook account.,Fraud, threats and manipulations,Endangering security,Direct threats of violence, including threats of a sexual or physical nature,,,,,Authority figures,Civilian sector,2014-07-07,,,http://www.blogopen.rs/pretnje-tviter-aktivisti-ovo-je-javni-poziv-na-linc/,https://archive.li/anU2j,,,,
Cyberattacks against Serbian President's website,The official website of the President of Serbia and its hosting server were attacked in an unknown way. Police promised an immediate investigation but its findings have never been revealed.,Cyber incidents,Disabled services,DoS/DDoS,,,,,Unknown,Public sector,2014-07-11,2014-07-11,,http://www.b92.net/info/vesti/index.php?yyyy=2014&mm=07&dd=11&nav_category=12&nav_id=875372,https://archive.li/x4pdU,,,,
Cyberattacks against Kurir website in August 2014,A series of cyberattacks targeted the website of daily newspaper Kurir. The Minister of Police claimed that the attack "occurred on one of 10,000 IP addresses".,Cyber incidents,Disabled services,DoS/DDoS,,,,,Unknown,Media sector,2014-08-10,2014-08-11,,http://www.kurir.rs/vesti/drustvo/sajt-kurira-pod-konstantnim-udarima-hakera-clanak-1504333,https://archive.li/JODWN,,,,
Cyberattacks against Peščanik in August 2014,Using code injection, around 30 texts were erased from Peščanik and replaced by a political message: "Stop lying!". In a repeated attack, instead of texts, headlines, and categories, the following message appeared: "If you feel good, have some strawberry jelly". ,Cyber incidents,Overtaking control,Technical attacks,,,,,Unknown,Media sector,2014-08-26,2014-08-30,,https://twitter.com/PlaceSoft/status/504366956141879296/photo/1,https://twitter.com/Pescanik/status/504569951043469312,https://archive.li/GnVQm,,,
Istvan Kaic's list of problematic Twitter users,A list of problematic Twitter users gathered around "Stop Censorship" initiative, who criticize the government, was published in an article written by an associate of the pro-government Public Policy Institute.,Fraud, threats and manipulations,Endangering security,Verbal attacks,,,,,Public figures,Public figures,2014-08-27,,,http://www.danas.rs/danasrs/dijalog/izopaceni_rezim_rada.46.html?news_id=287967,https://archive.li/BUyJe,,,,
Verbal assaults and threats to Juzne vesti journalists,The deputy mayor of Niš offended journalists and called them foreign mercenaries. A few days later, violence threats to journalists appeared on the Facebook page of the portal. Police started investigation.,Fraud, threats and manipulations,Endangering security,Direct threats of violence, including threats of a sexual or physical nature,,,,,Individual,Media sector,2014-08-29,2014-09-02,,https://soundcloud.com/novinar/ljubivoje-slakovic-o-juznim-vestima,http://www.juznevesti.com/Drushtvo/Nove-pretnje-novinarima-Juznih-vesti.sr.html,http://www.juznevesti.com/komentar/Aleksandar-Stankov/Zasto-vicete.sr.html,,,
Threats and insults against Darko Mitrovic on Twitter,The former host of radio show "Mentalno Razgibavanje" (Eng. Mental Stretching) was threatened on Twitter by Dragan J. Vučićevic, editor-in-chief of a pro-government tabloid.,Fraud, threats and manipulations,Endangering security,Verbal attacks,,,,,Media sector,Media sector,2014-09-28,2014-09-29,,https://twitter.com/eXrazgibavanje/status/516707439324852224,https://archive.li/rTn1b,,,,
Personal data of Serbian Progressive Party internet team and their applications published online,Names, residential and email addresses, and phone numbers of members of the Internet team of the ruling party were published twice on the website of Teleprompter within the initiative to disclose the so-called bot-network organized for political astroturfing.,Privacy and data protection,Disclosure of data,Website posting (including public registries and platforms),,,,,Responsible person from the media sector,Mass casualty,2014-10-06,2014-10-09,,https://www.cenzolovka.rs/vesti/objavljujemo-sve-tajne-sns-botova-fotografije-uputstva-programe-telefone/,https://archive.li/4ixF3,,,,
Blogger and Twitter user Darije Hajric threatened with lawsuit,A co-author of of "Lifestyle Serbia" campain threatened the blogger with a lawsuit unless he removed the tweets in which he criticized the campaign, parly financed from the state budget.,Fraud, threats and manipulations,Limiting freedom of expression,Abuse of legal mechanisms,,,,,Public figures,Public figures,2014-10-08,,,https://twitter.com/romulian/status/519906260188024833,https://twitter.com/romulian/status/517599883101216768,https://archive.li/ilbEd,,,
Faculty of Organizational Science's student portal under cyberattack,The website Puskice.org run by students of the Faculty of Organizational Sciences experienced a cyberattack. The administrators claimed that the attack came from the server of the Computing Center of the University of Belgrade.,Cyber incidents,Disabled services,DoS/DDoS,,,,,Unknown,Media sector,2014-10-10,,,http://www.puskice.org/vest/10102014/sajt-puskica-ponovo-pod-napadom,https://archive.li/R6o59,,,,
Blogger Milan Jovanović Strongmen insulted on Facebook,Blogger Milan Jovanović Strongman received offensive and extremely vulgar comments via Facebook.,Fraud, threats and manipulations,Limiting freedom of expression,Verbal attacks,,,,,Individual,Public figures,2014-10-11,,,http://blog.b92.net/text/24741/Maketa-drzave/,https://twitter.com/milan_strongman/status/520960708423725056,https://archive.li/flGpL,,,
Employee of Zelvoz fired over Facebook post,A worker and labour union activist from Smederevo company Zelvoz was fired over a Facebook status in which he among other things posted a criminal lawsuit filed against the factory director.,Fraud, threats and manipulations,Limiting freedom of expression,Cyber-mobbing	Retaliation,,,,,Individual,The public,2014-10-11,,,http://www.b92.net/biz/vesti/srbija.php?yyyy=2014&mm=10&dd=11&nav_id=910247,https://archive.li/H6ZRc,,,,
Football match Serbia−Albania, online violence,During the football match between national teams of Serbia and Albania when a drone with the Albanian flag appeared over the staduim, social networks were swamped with offensive and threatening comments against Albanians. Verbal violence also appeared on the front pages of tabloids.,Fraud, threats and manipulations,Discrimination and hate speech,Verbal attacks,,,,,Individual,The public,2014-10-14,2014-10-15,,https://twitter.com/CrvenaPlavusaa/status/522148960241451011,https://twitter.com/zajebanimachor/status/522134648458346497,https://twitter.com/SirOliverrr/status/522113204705841153,,,
Football match Serbia−Albania, mutual attacks targeting online portals,In the days following the football match Serbia−Albania, Serbian and Albanian online communities exchanged a series of hacking attacks. Among others, the targets were the website of the Arts Academy in Novi Sad, Radio-Television of Albania, 24 Hours, Blic, Kurir, and Telegraf.rs.,Cyber incidents,Disabled services,DoS/DDoS,,,,,Unknown,Media sector,2014-10-15,2014-10-20,,http://www.b92.net/info/vesti/index.php?yyyy=2014&mm=10&dd=21&nav_category=12&nav_id=914281,http://www.kurir.rs/vesti/drustvo/hakerski-udar-albanaca-srbija-napadnuta-sa-1500000-racunara-clanak-1593341,https://archive.li/E7uCK,,,
Insults and threats to actor Goran Jevtic after text in Blic,A tabloid article about Goran Jevtic, actor from Belgrade, sparked hate speech, insults, and threats via social networks against the actor and the LGBT community in general. As a result of the pressure coming from citizen acivists through social networks, the tabloid to some extent withdrew from the campaign.,Fraud, threats and manipulations,Discrimination and hate speech,Verbal attacks,Endangering security,Organized attacks on networks targeting vulnerable communities (women, lgbtq+, ethnic minorities, refugees and migrants),,,Individual,Public figures,2014-10-21,,,https://www.6yka.com/novosti/medijski-linc-gorana-jevtica-ima-li-granica-u-trci-za-profitom,https://twitter.com/BUHATheater/status/524974286164226049,http://pescanik.net/s-onu-stranu-autocenzure/,,,
Valjevo local government accuses portal of being "harmful to the honour and dignity of the town and the country",Local government in Valjevo made official accusations against anonymous media for intentionally stating lies "harmful to the honour and dignity of the town and the country".,Fraud, threats and manipulations,Public misinformation,Creating fake content and accounts,Character assassination,Creating fake content and accounts,,,Authority figures,Media sector,2014-10-22,2014-10-23,,https://www.kolubarske.rs/sr/vesti/valjevo/1456/Ko-%C5%A1teti-ugledu-na%C5%A1eg-grada-i-dr%C5%BEave.htm,https://archive.li/4PWdN,,,,
Istvan Kaic sued journalist Milos Vasic for "insult, lies, and defamaton",An associate of the pro-government Public Policy Institute filed a lawsuit against journalist Milos Vasic for the text published on Autonomija.info, the website of the Independent 2' Association of Vojvodina.,Fraud, threats and manipulations,Limiting freedom of expression,Abuse of legal mechanisms,,,,,Public figures,Media sector,2014-10-27,,Dobio presudu po odluci Višeg suda u Beogradu, optuženi dužni da isplate po 100.000 dinara sa kamatom,https://twitter.com/V_Obradovic/status/526700571752144897,http://www.autonomija.info/milos-vasic-objavljotina-istvana-kajica.html,https://www.cenzolovka.rs/pritisci-i-napadi/kaic-dobio-medije-na-sudu-zbog-teksta-milosa-vasica/,,,
Luka Bozovic brought in for police questioning over tweet,The general secretary of Social Democratic Youth was brought in for questioning over a tweet which was interpreted as a death threat to the editors of Kurir, Blic, and Telegraf.,Fraud, threats and manipulations,Limiting freedom of expression,Abuse of legal mechanisms,,,,,Authority figures,Political subject,2014-10-30,,,https://twitter.com/lukazb/status/522390233019875328,https://twitter.com/lukazb/status/527815612270379008,https://lukabozovic.wordpress.com/2014/10/31/proces/,,,
Journalist of Novi Magazin insulted for reporting about "bugging affair",Editor of the pro-government tabloid Informer insulted a journalist who criticized the tabloid's reporting on the alleged intentions to bug the Prime Minister in a Belgrade hotel.,Fraud, threats and manipulations,Limiting freedom of expression,Verbal attacks,,,,,Media sector,Media sector,2014-11-05,,,https://www.facebook.com/photo.php?fbid=10152563406077950,https://archive.li/x8EZD,,,,
Facebook and Twitter users accused of "attacking Vučić and spreading lies about him",Weekly newspaper Afera wrote that some tycoons and opposition leaders have teams that "attack Vučić and spread lies about him" on social media.,Fraud, threats and manipulations,Character assassination,Creating fake content and accounts,Public misinformation,Verbal attacks,,,Public figures,Public figures,2014-11-05,,,https://twitter.com/Constrictoria/status/529934570620481536,https://archive.li/cnfyH,,,,
Twitter user brought in for questioning for organizing protest #MlekoUp related to aflatoxin affair,An activist stated that the police had told him he would be brought in for questioning because he participated in the protest #MlekoUp related to the aflatoxin affair 20 months earlier.,Fraud, threats and manipulations,Limiting freedom of expression,Abuse of legal mechanisms,,,,,Authority figures,Civilian sector,2014-11-21,,,https://twitter.com/MarkoZvkvc/status/535798849739423744,https://archive.li/wVKId,,,,
Personal data of over 5 million Serbian 1 publicly available,A database containing personal data of over 5 million Serbian 1 was published on the Agency for Privatisation. The database was removed after the Comissioner's intervention and the Agency stated that the incident resulted from a hacking attack onto their server. ,Privacy and data protection,Data leakage,Curenje na veb sajtu (uključujući javne registre i platforme) ,,,,,Responsible person from the public sector,Mass casualty,2014-12-11,2014-12-12,Agencija za privatizaciju je podnela krivicnu prijavu nadležnom tužilaštvu, protiv NN lica, dok je Poverenik nadležnom sudu za prekršaje podneo zahtev za pokretanje postupka. Agencija je u meduvremenu ugašena, a prekršajni postupak je zastareo.,https://resursi.sharefoundation.info/sr/resource/agencija-za-privatizaciju-jedinstven-slucaj/,https://archive.li/EaQQS,,,,
Istvan Kaic accused civil society institutions for disinformation and manipulating public opinion,On E-novine portal, Istvan Kaic published his view of the reporting on the big floods in May in the form of a comprehensive analysis in which he accuses NUNS, OSCE, a lot of 9 and civil society organizations, including SHARE Foundation and the Commissioner.,Fraud, threats and manipulations,Character assassination,Creating fake content and accounts,Public misinformation,Verbal attacks,,,Public figures,Civilian sector,2014-12-15,,,https://resursi.sharefoundation.info/sr/resource/internet-slobode-i-digitalna-prava-u-srbiji/,,,,,
Beba Kron threatened and offended via Twitter,Beba Kron, director of Institute of Criminological and Sociological Investigation, received threats in private messages from various Twitter profiles she was not following. She temporarily suspended her account.,Fraud, threats and manipulations,Endangering security,Direct threats of violence, including threats of a sexual or physical nature,,,,,Individual,Public figures,2014-12-16,,,http://www.b92.net/video/vesti.php?yyyy=2014&mm=12&dd=16&nav_id=937169,https://twitter.com/VladanBa/status/544251070047064064/photo/1,https://archive.li/acC71,,,
Journalist of Juzne vesti received "bullet" threats, case dismissed,A journalist of Juzne vesti received death threats on Facebook after publishing a text on the case of ambulance in Leskovac denying to help an old lady.,Fraud, threats and manipulations,Endangering security,Direct threats of violence, including threats of a sexual or physical nature,,,,,Individual,Media sector,2014-12-30,,,http://www.juznevesti.com/Drushtvo/Pretnja-novinaru-Juznih-vesti-Dao-bih-ti-ja-metak-u-celo.sr.html,https://www.juznevesti.com/Istrazujemo/Tuzilastvo-odbacilo-krivicnu-prijavu-za-pretnje-novinaru.sr.html,https://archive.li/USQXd,,,
Journalists of Juzne vesti threatened after text about public procurement corruption in nis,An anonimous reader posted offensive comments and threats on the website of Juzne vesti. Police identified the owner of the IP address where the threat came from.,Fraud, threats and manipulations,Endangering security,Direct threats of violence, including threats of a sexual or physical nature,Endangering security,Verbal attacks,,,Individual,Media sector,2014-12-30,,Sud oslobodio optužbi i utvrdio da izjava "treba vas zapaliti" nije pretnja.,http://www.juznevesti.com/Drushtvo/Pretnje-Juznim-vestima-zbog-tekstova-o-tenderu.sr.html,http://www.juznevesti.com/Hronika/Novinarima-pretio-sluzbenik-Direkcije-za-javni-prevoz.sr.html,http://nuns.rs/info/activities/26525/sud-treba-zapaliti-novinare-nije-pretnja.html,,,
Infomer attacked NUNS president over tweets,Informer daily newspaper accused Vukasin Obradovic, president of Independent 2' Association of Serbia (NUNS), that he had "nothing against Vučić's assassination", which Informer deduced from Obradovic's tweets about Tabloid, a paper which publishes controversial content. ,Fraud, threats and manipulations,Public misinformation,Creating fake content and accounts,Character assassination,Verbal attacks,,,Media sector,Media sector,2015-01-03,,,http://www.cenzolovka.rs/vesti/informer-izmislio-da-predsednik-nuns-a-ima-razumevanja-za-ubistvo-vucica/,http://www.cenzolovka.rs/wp-content/uploads/2015/09/Informer_Vukasin-1.jpeg,http://www.magazin-tabloid.com/casopis/?id=06&br=327&cl=01,,,
TV host and comedian Zoran Kesic targeted via social networks over his status,Zoran Kesic, TV host of the program “24 Minuta”, published a Facebook post in which he strongly reacted to the statements which in his view relativized the crime against the caricaturists of Charlie Hebdo. After that, he was exposed to insults in social media.,Fraud, threats and manipulations,Endangering security,Verbal attacks,,,,,Unknown,Public figures,2015-01-09,,,http://mondo.rs/a760321/Info/Drustvo/Napad-u-Parizu-Zoran-Kesic-Ja-nisam-Charlie-ali-znam-ko-sam-i-sta-sam.html,https://twitter.com/aya_mr_aya/status/553518567862579200,https://archive.li/YWMFs,,,
TV station targets journalist by disclosing details from her private life,Since the beginning of the year, TV Jumbo portal published a series of texts which contain information about private life, accusations, and insults against Blic journalist Ivana Andjelkovic.,Fraud, threats and manipulations,Public misinformation,Creating fake content and accounts,Character assassination,Verbal attacks,Endangering security,Doxxing,Media sector,Media sector,2015-01-11,2015-03-05,,http://web.archive.org/web/20150309193820/http://tvjumbo.net/index.php?strana=prikaz.php&id=2328,http://archive.li/ykAST,,,,
